2021-07-26,上海中心大厦的镇楼神器动了,何同学毕业,举重比赛裁判改判,上海已有36.2万人成功转移,中国暂列奖牌榜第一,奥运会,台风烟花会不会被除名,RM因为转播奥运会停播,郭晶晶现场见证施廷懋王涵夺冠,谌利军获男子举重67公斤级金牌,男子举重67公斤级决赛,王璐瑶说巴黎我还会再来,许昕是喜剧人吗,中部战区上将灾区救援被网友认出,杨倩最后一枪三届奥运记者手抖,被陈娇蕊气死,樊振东欲摸又止,主人回应狗子看奥运开幕式吓跑,李沁问xxj的意思是幼稚吗,上海处于台风危险半圆,益禾堂致歉,鸿星尔克董事长请求网友理性消费,侯志慧回应弟弟预测举起220公斤,马龙为何被称为六边形战士,张雨霏妈妈的颜值有多绝,Uzi范丞丞组建LOL手游战队,河南29.6万人需紧急生活救助,意大利举重小哥Zanni好帅,刘雨昕全开麦,中国体操女队进入团体决赛,如何在失恋后避免自我否定,东京奥运会中国制造已就位,许昕欲吹又止,日本金牌,澳大利亚球员沙雕式喝水,于逸飞救人时喊了句勇敢牛牛不怕困难,3岁孩子掉站台缝隙3分钟获救,鸿星尔克门店深夜12点挤满顾客,刘晓庆朱时茂演黄昏恋,孙一文帮闺蜜申请王嘉尔签名照,中国运动员逆转夺冠名场面,四川泸州已排查密接次密接668人,北京地铁三家便利店正式开业,张艺兴晚安电台,孙一文曾因体能测试出局,施廷懋和王涵都是郭晶晶迷妹,台风天钱塘江边多人看潮,赵帅战略性减重方法是吐口水,台风烟花,朱婷父亲为女排鼓劲加油,

2021-07-26,何同学毕业,上海中心大厦的镇楼神器动了,奥运会,眼周马拉松,上海已有36.2万人成功转移,举重比赛裁判改判,郭晶晶现场见证施廷懋王涵夺冠,中国暂列奖牌榜第一,台风烟花会不会被除名,中部战区上将灾区救援被网友认出,杨倩最后一枪三届奥运记者手抖,RM因为转播奥运会停播,上海处于台风危险半圆,主人回应狗子看奥运开幕式吓跑,许昕是喜剧人吗,杭州台风,被陈娇蕊气死,河南29.6万人需紧急生活救助,鸿星尔克董事长请求网友理性消费,王璐瑶说巴黎我还会再来,樊振东欲摸又止,李沁问xxj的意思是幼稚吗,莫铭被诬陷家暴,鸿星尔克门店深夜12点挤满顾客,马龙为何被称为六边形战士,侯志慧回应弟弟预测举起220公斤,谌利军获男子举重67公斤级金牌,意大利举重小哥Zanni好帅,3岁孩子掉站台缝隙3分钟获救,东京奥运会中国制造已就位,孙一文曾因体能测试出局,张雨霏妈妈的颜值有多绝,北京地铁三家便利店正式开业,刘晓庆朱时茂演黄昏恋,中国体操女队进入团体决赛,澳大利亚球员沙雕式喝水,男子举重67公斤级决赛,四川泸州已排查密接次密接668人,刘雨昕全开麦,于逸飞救人时喊了句勇敢牛牛不怕困难,中国运动员逆转夺冠名场面,施廷懋和王涵都是郭晶晶迷妹,上海暴雨,Uzi范丞丞组建LOL手游战队,台风烟花,益禾堂致歉,孙一文帮闺蜜申请王嘉尔签名照,台风天钱塘江边多人看潮,天天向上,许昕欲吹又止,

2021-07-26,何同学毕业,上海中心大厦的镇楼神器动了,这届奥运被中国网友的留言戳到了,饿了么暂停上海部分沿海区域配送,何同学 理工男的浪漫,珠海疫情,余姚暴雨,南京疫情,央视主播说面对天灾宁防空也不可破防,中国暂列奖牌榜第一,跨性别举重运动员,分散多年的叙利亚兄弟在奥运会上重逢,台风烟花,郭晶晶现场见证施廷懋王涵夺冠,台风烟花即将再次登陆,卫辉内涝,台风烟花会不会被除名,南京暴雨,举重比赛裁判改判,RM因为转播奥运会停播,何洛洛吃完饭把碗带走了,警方回应市民高架桥上停车防台风暴雨,上海已有36.2万人成功转移,奥运会,许昕是喜剧人吗,重庆女孩施廷懋夺金家人喜极而泣,上海轨道交通全网地面高架区段暂停运营,珠海全市全员核酸检测,被陈娇蕊气死,司梦揭露魏岚假怀孕,心疼秦明,主人回应狗子看奥运开幕式吓跑,杨倩最后一枪三届奥运记者手抖,国内油价或遇年内第二次下调,侯志慧回应弟弟预测举起220公斤,拜尔斯好强,Red Velvet回归预告,请给卫辉让出救援通道,张哲瀚说蓝天救援队是盖世英雄,中部战区上将灾区救援被网友认出,31省区市新增76例确诊,水泥迎超长淡季,南京新增38例本土确诊,鸿星尔克门店深夜12点挤满顾客,安徽新增无症状1例,河南新一轮大范围降雨将开始,李沁问xxj的意思是幼稚吗,刘涛为萧嫣鸣不平,玉楼春长沙台开播,东京奥运会中国制造已就位,

2021-07-26,张雨霏获女子100米蝶泳银牌,加拿大华裔选手100米蝶泳夺冠,李冰洁获女子400米自由泳铜牌,郭晶晶在看台唱国歌,扛起孙一文就跑的光头教练真面目,徐嘉余100米仰泳晋级决赛,跨性别举重运动员,衡水中学回应在美上市,东京奥运收视率创33年最低,开赛两天29枚金牌花落谁家,鸿星尔克库存告急,宁波余姚市下了约37个西湖水量,南京新增38例本土确诊,张雨霏好可惜,上海自来水变脏了是谣言,顾客边剪鸿星尔克发型边抢服装,杨舒予好绝,一张球台四个世界冠军,体操男团冲金,台风烟花,王正卓 y小姐是真心喜欢,昕雯组合拼奥运国乒首金,奥运会,中国三人女篮奥运三连胜,张雨霏摘银后比耶喊加油,玉楼春,宋茜奥运播报,东京奥运获奖者可不戴口罩30秒拍照,河南新一轮大范围降雨将开始,余姚暴雨,李冰洁破女子400米自由泳亚洲纪录,新东方称考虑采取适当合规措施,芜湖疫情,虹桥火车站通宵开放收容滞留乘客,长春火灾已致15人死亡,王涵与何姿的神仙友情,时代少年团新歌我喜欢你,任素汐哭戏感染力,余姚公布防台风救助电话,中国暂列奖牌榜第一,老板为救援队偷加排骨还霸气免单,南京2例确诊病例轻型转重型,苏南机场取消航班194个,上海气象小哥回应台风天嘶吼式报道,后场的侯志慧也太可爱了,南京疫情,郑州男子15楼窗外拉水绳子断裂,何同学 理工男的浪漫,下雨后狗狗的作用,这届奥运被中国网友的留言戳到了,

2021-07-26,阿迪达斯因消防不符标准被罚,沙葱卖50一斤仍供不应求,加拿大华裔选手100米蝶泳夺冠,蔡卓宜坐王大陆大腿,余姚暴雨,南京本轮疫情已有确诊75例无症状13例,夏日代表作,从特困家庭走出的世界冠军,基金大跌,张雨霏获女子100米蝶泳银牌,卫辉内涝,池昌旭确诊新冠,韩国射箭好准,中国男子射箭团体出局,奥运乒乓球史上年纪最大的参赛者,南京卫健委回应孕妇无法产检,关晓彤超大蝴蝶结,狙击手为啥不参赛奥运会射击,雷军晒鸿星尔克鞋,韩红爱心慈善基金会声明,王丽丽好强,母亲称张雨霏已做到最好的自己,杨洋迪丽热巴自拍视频,上海交通大学祝贺李冰洁摘铜,李泉当爸,顾客边剪鸿星尔克发型边抢服装,本人有信心参加的奥运项目,王嘉尔金属创口贴,邮递员给儿子送北大录取通知书,南京2例确诊病例轻型转重型,台风烟花为啥走得那么慢,郑州大姐含泪给消防送热鸡蛋,台风下的上海社畜,男子双人10米跳台决赛,海底捞上半年扭亏为盈,台风烟花,成都暴雨,李冰洁获女子400米自由泳铜牌,王正卓 y小姐是真心喜欢,西安暴雨,中国女子水球VS美国女子水球,白鹿演的林少春,魏萌以资格赛第一名进女子双向飞碟决赛,张基龙将入伍,东契奇半场31分,更美App被强制执行超5500万,羽毛球混双,金晨演的许凤翘,16岁滑板少女曾文蕙进入奥运决赛,奥运会,

2021-07-26,中方已向美方提出两份清单,台风烟花,超30%英国人删掉新冠追踪App,蓄过的力 是此刻的光,美国金牌,余姚暴雨,英国队最后一跳太强了,郭晶晶为小师妹奥运夺金高兴,姚景元选择复读一年,王嘉尔的纹身,卫辉内涝,杭州杀妻案一审宣判,跳水比赛的信息栏就离谱,运动员身材好像hellokitty,欧阳娜娜张子枫合体登封面,近千人70小时封堵卫河决口,王珞丹说中国滑板队太酷了,因运动员太强而设立的规则,奖牌榜,东京奥运会现首例赛后新冠阳性,曹缘陈艾森男子双人10米台摘银,曹缘陈艾森失误,蔡卓宜坐王大陆大腿,被奥运会禁止的体操动作,陈艾森用毛巾挡着,日本柔道冠军取名好随意,张本智和手受伤,杨幂为周笔畅庆生,如何正确应对伴侣出轨,关晓彤超大蝴蝶结,南京所有景区户外活动全部临时关停,指挥部呼吁非必要勿前往卫辉,奥运会运动员颜值能有多高,飞碟射击看不到飞也看不到碟,特朗普炮轰跨性别运动员参加女子项目,国乒早期相亲图鉴,国乒的祖传舞蹈动作,网友谐音梗总结中国金牌战绩,把狗狗举高高的救援队找到了,南京三名确诊病例从事高校宿管工作,台风烟花外围已影响山东,山大录取通知书送拼图盲盒,南京一确诊病例曾到山东日照旅游,张雨霏惜败摘银给自己打99分,铁人三项水质,曾文蕙由武术改练滑板,奥运会那些奇怪的比赛项目,母亲曾因家境不好劝谌利军别练了,新乡9岁男孩成最小志愿者,池昌旭确诊新冠,

2021-07-26,体操男团决赛,救援队呼吁网红和明星为救援让路,乒乓球混双决赛,蓄过的力 是此刻的光,主持人含泪说卫辉需要你,黄轩 中国跳水队永远是我们的骄傲,孙炜鞍马15.00分第一,肖若腾吊环上wink,女子举重55公斤级决赛,廖秋云97公斤抓举成功,被奥运会禁止的体操动作,美国金牌,郑州地铁5号线失联者邹德强确认遇难,郑州京广快速路隧道发现6名遇难者,运动员身材好像hellokitty,昕雯联播今晚冲金,程潇家人不知道她是做什么的,颜鹏绝杀,男团体操解说,朱婷父亲称女儿很关心河南灾情,姚景元选择复读一年,台风烟花,林超攀失误,这就是街舞4舞者阵容,吴京中国表情包出处,敖子逸被路人要微信,赛后曹缘向陈艾森说对不起,你是我的荣耀开播,台风烟花中心已进入江苏境内,南京三名确诊病例从事高校宿管工作,阚清子演的榴莲好A,浙江上海江苏安徽部分地区有大暴雨,长津湖定档,王嘉尔的纹身,辽宁沈阳一居民家发生爆炸,超30%英国人删掉新冠追踪App,你的下个手机充电器可能在你指尖,不得将最严算法作为送餐员考核要求,上海黄浦江16条越江隧道全开,杭州杀妻案一审宣判,特朗普炮轰跨性别运动员参加女子项目,狗类的悲喜并不相通,当猫咪学会跳水后,高诗岩球鞋写满队友名字,加一箱油少花4元,邹敬园双杠全场最高分,中国三人男篮绝杀波兰,许昕刘诗雯2比0领先,卫辉,母亲曾因家境不好劝谌利军别练了,

2021-07-26,许昕刘诗雯获混双银牌,水谷隼吹球,微信终于支持多设备同时在线,刘国梁和马琳的掌声,无论结果你们都是中国骄傲,福原爱解说,每一个ID都会相遇,救援队呼吁网红和明星为救援让路,乒乓球混双决赛,乒乓球规则,卫辉8个月婴儿乘水上120瞬间不哭了,刘诗雯哭了,南京辟谣已经有300多例感染者,中国香港首金,南京快递外卖人员一律不得进入小区,主持人含泪说卫辉需要你,许昕刘诗雯赛后采访,程潇家人不知道她是做什么的,国产剧海报审美怎么了,南京疫情传播链再延长,迪丽热巴演的乔晶晶,肖战方否认隐婚生子,邹德强岳父岳母发声,刘诗雯眼神,金牌榜,大连疫情,林超攀失误,中国体操男团获得铜牌,蓝盈莹 女生永远是姐姐,乒乓球赛程,刘宇宁 我的本命是黄子韬,中国网球女单全军覆没,河南卫辉成水中孤城,奥运会,黄轩 中国跳水队永远是我们的骄傲,郑州京广快速路隧道发现6名遇难者,原来运动也可以这么优雅,张哲瀚直播状态,江苏宿迁一地调整为中风险地区,直播台风烟花,辽宁沈阳发现11份环境样本核酸为阳性,直击河南卫辉救援现场,北辙南辕,我在他乡挺好的,曹缘说单人赛再拼一把,南京疫情已关联5省9市,你是我的荣耀预告,南京市政务中心就服务热线接不通致歉,奥运会赛程,中国三人女篮负美国,

