2021-07-14,b站崩了,港大不再承认学生会在校内的角色,王一博受伤做核磁共振,A站也崩了,20年前的那声Beijing,减肥瘦十斤是什么概念,上海云海服务器,小燕子的眼睛能有多大,请回答1988真的太好哭了,刘国梁说这次奥运会备战极其艰难,丈夫迷恋女主播妻子带女儿投江,谷嘉诚 切走半块香皂,电影失孤中的两个细节成真了,原国家粮食局副局长徐鸣被查,隐形社恐,b站 停电,刘浩存妈妈回应,晋江崩了,童谣害怕和陆思诚分手,夫妻半年剪出7.6米清明上河图,陈睿,蒙古上单,豆瓣崩了,迪丽热巴蓝色渐变礼服,这就是街舞,宋茜晒偷吃蛋糕的猪,陆思诚五杀好燃,国际空间站,汽车自动报警出卖醉驾翻车男子,近视年增长超50度建议别手术,王一博自贡,谭松韵白敬亭乡偶剧,谷爱凌是真人版天才少女吧,一口西瓜花了28元,沙溢演的脱口秀演员,拜托了冰箱,比尔盖茨承认是自己搞砸了婚姻,加拿大又一学校再现160座无名墓,梅桢放弃华东政法大学任教机会,赵立坚说中国必须也必然统一,俄男子手中植入5枚芯片可徒手刷门禁,女超18岁男超20岁才能做近视手术,王一博 纪录片,龚俊男友力,李现 谷嘉诚,密室npc太入戏怎么办,未定事件簿亲亲,得亏爸爸会断句,喻言密室拍照教学,陌生的恋人,

2021-07-14,b站崩了,港大不再承认学生会在校内的角色,A站也崩了,王一博受伤做核磁共振,减肥瘦十斤是什么概念,加拿大又一学校再现160座无名墓,刘国梁说这次奥运会备战极其艰难,小燕子的眼睛能有多大,20年前的那声Beijing,上海云海服务器,夫妻半年剪出7.6米清明上河图,原国家粮食局副局长徐鸣被查,俄男子手中植入5枚芯片可徒手刷门禁,电影失孤中的两个细节成真了,请回答1988真的太好哭了,b站 停电,刘浩存妈妈回应,豆瓣崩了,晋江崩了,童谣害怕和陆思诚分手,蒙古上单,陈睿,宋茜晒偷吃蛋糕的猪,孙怡演的夏颜好刚,这就是街舞,迪丽热巴蓝色渐变礼服,王一博自贡,谷爱凌是真人版天才少女吧,丈夫迷恋女主播妻子带女儿投江,汽车自动报警出卖醉驾翻车男子,比尔盖茨承认是自己搞砸了婚姻,看虞书欣吃播好满足,一口西瓜花了28元,谭松韵白敬亭乡偶剧,陆思诚五杀好燃,国际空间站,李现 谷嘉诚,女超18岁男超20岁才能做近视手术,近视年增长超50度建议别手术,赵立坚说中国必须也必然统一,薇娅直播,谷嘉诚 切走半块香皂,梅桢放弃华东政法大学任教机会,隐形社恐,沙溢演的脱口秀演员,龚俊男友力,拜托了冰箱,说唱听我的第二季定档,王一博 纪录片,陌生的恋人,

2021-07-14,央视主播提醒有些人别动歪脑筋,奥斯卡获奖导演拍中国小康纪录片,B站服务器机房故障造成无法访问,不好的全抛光,王一博受伤做核磁共振,马来西亚一疫苗接种点200余工作人员确诊,上海消防称B站大楼未见火情,离家六年阳台长出两棵大树,减肥瘦十斤是什么概念,东京奥运乒乓球比赛不许手触球台或吹球,港大不再承认学生会在校内的角色,费德勒退出东京奥运会,10名大学生女兵为边防界碑描红,苹果MagSafe外接电池来了,电影失孤中的两个细节成真了,俄男子手中植入5枚芯片可徒手刷门禁,刘浩存妈妈回应,公交车主题出租房,宋茜晒偷吃蛋糕的猪,写给王俊凯的一封手写信,夫妻半年剪出7.6米清明上河图,童谣害怕和陆思诚分手,孙怡演的夏颜好刚,特斯拉ModelY预订排到9月中旬,当你养了一只仓鼠,小燕子的眼睛能有多大,2008年的北京一夜,谷爱凌是真人版天才少女吧,看虞书欣吃播好满足,汽车自动报警出卖醉驾翻车男子,20年前的那声Beijing,迪丽热巴蓝色渐变礼服,这就是街舞,一口西瓜花了28元,李现 谷嘉诚,李易峰晒自拍照,加拿大又一学校再现160座无名墓,中国医生,谭松韵白敬亭乡偶剧,刘国梁说这次奥运会备战极其艰难,赵立坚说中国必须也必然统一,陆思诚五杀好燃,消防向苏州酒店坍塌遇难者默哀,安徽农业大学,妈妈永远最喜欢你,隐形社恐,梅桢放弃华东政法大学任教机会,女超18岁男超20岁才能做近视手术,女记者正常采访时遭暴力挥拳相向,请回答1988真的太好哭了,

2021-07-14,新乡一产妇第三胎生下龙凤四胞胎,王一博 我不是来玩的是真的想玩好,央视主播提醒有些人别动歪脑筋,频繁聊天会出现恋爱错觉吗,刘在石签约柳熙烈公司,海南心脏在武汉救了黑龙江小伙,教科书式老赖主动赔500元还欠74万,苏州酒店坍塌事故17人遇难,B站服务器机房故障造成无法访问,港大不再承认学生会在校内的角色,这手机怎么死机了,日军731部队新罪证,马来西亚一疫苗接种点200余工作人员确诊,美国加州请80头山羊应对森林野火,离家六年阳台长出两棵大树,Jennie腰线,两个人的小森林官宣,连口型都对得上,现在的小说有多敢写,意大利或和阿根廷踢友谊赛,大妈高铁吸烟触发警报下跪求饶,杨幂双马尾白T造型,领导上班摸鱼该如何应对,被催婚时的反向操作,今天是海绵宝宝生日,美国私人监狱背后产业链令人触目惊心,刘浩存妈妈回应,安徽农业大学,上海消防称B站大楼未见火情,20年前的那声Beijing,宋茜晒偷吃蛋糕的猪,妈妈永远最喜欢你,东京奥运乒乓球比赛不许手触球台或吹球,王一博受伤做核磁共振,女记者正常采访时遭暴力挥拳相向,中国年龄最小的红军,减肥瘦十斤是什么概念,专家提醒目前不存在逆转近视神器,李现 谷嘉诚,赵立坚说中国必须也必然统一,写给王俊凯的一封手写信,安徽农业大学回应副院长涉嫌骚扰女学生,童谣害怕和陆思诚分手,猫咪打架有多凶,庐山三叠泉百米瀑布现彩虹,这就是街舞,安阳殷墟雪糕上新甲骨文皮肤,特斯拉ModelY预订排到9月中旬,苹果MagSafe外接电池来了,杉树上长出榕树相依为命60年,

2021-07-14,美团宣布腾讯认购事项已完成,实验室起火博士后头顶火苗冲出,微信支持更改来电铃声,频繁聊天会出现恋爱错觉吗,阮经天和宋祖儿在一起过吗,从手术中醒来有多恐怖,迪丽热巴机场饭拍,老师收到半个西瓜回赠全班西瓜宴,河南驻马店6名学生溺亡,国务院安委会对苏州酒店坍塌事故挂牌督办,多个公交站现李白再世个人广告,17岁男孩报警救回醉酒女孩,连口型都对得上,郭新振打算留在养父母身边,宋祖儿工作室辟谣,易烊千玺开博八周年自拍,肖战为海绵宝宝庆生,张馨月穿婚纱为林峯唱勇气,安徽农业大学回应副院长涉嫌骚扰女学生,现在的小说有多敢写,台媒称阮经天宋祖儿已分手8个月,甜茶近照状态,于谦 50多了换个工作有可能吗,Jennie腰线,杨幂双马尾白T造型,徐冬冬 卑微的去爱一个人好难,日军731部队新罪证,龙凤四胞胎妈妈讲述经过,贾跃亭被执行总金额超41亿,新疆各民族平等权利的保障白皮书,虞书欣张彬彬湖光森野大片,地铁站3小时里4人因未吃早饭晕倒,中国女排出征前按下金手印手模,西安停电,关不掉的手机APP广告该治,黑怕女孩官宣定档,南非骚乱一商场遭扫荡式抢劫,中国奥运健儿在训练基地升起国旗,夏日空调清洗师日薪千元,连狗狗都有结婚照了,极危物种圆鼻巨蜥罕见露脸,大熊猫一顿饭能吃多少竹笋,珠海长隆再次成功繁育濒危物种豹纹鲨,自律的海豹有多可怕,华颜抽脂填充手术,苏州酒店坍塌事故获救者发声,失孤原型拐卖案嫌犯招供画面,虞书欣张彬彬cp感,24岁退伍军人跳3米高桥救人,四人间该怎么选床位,

2021-07-14,茶颜悦色希望停止跨城代购,被家长骂哭保洁阿姨获景区奖励,女儿吐槽妈妈花800买歌手代言咖啡机,笔记本电脑需要每天关机吗,茶颜悦色长沙代购至杭州涨价三倍,民警吃饭认出服务员是嫌疑人,B站因服务器故障向部分用户发放补偿,男子工作5年体重飙至400斤,上海地铁提醒车厢内少跷二郎腿,全国已连续4年多未发生暴恐案事件,张哲瀚被救护车接走,Angelababy说瞬间的崩溃难以自愈,李子柒柴米油盐酱醋茶完结,父亲威胁将3岁儿子扔下14楼被捕,原来桃子之间也有竞争,童谣被逼道歉,宋茜 谁偷了我的人生,辛芷蕾 你就说有没有内个味,丝瓜千万要斜着切,沈阳警方通报一起持刀伤人案,网红小冉抽脂感染去世,冉莹颖身材,情侣扶梯上热吻仰翻摔下,王一博张哲瀚撞衫,日本无印良品胜诉北京无印良品,宣璐嗑cp代餐恋爱,iPhone13或有日落金玫瑰金,心动的信号,男子偷手机留字暗示明早取密码被抓,东京奥运会中国代表团名单,有一个好房东是什么体验,阮经天方否认与宋祖儿恋情,苏院长发现马天明冒充蔡里昆,男子吃野生菌中毒说看见泥石流,龙猫这辈子没这么害怕过,张嘉倪接发vlog,扫码点餐真的更便利吗,成都暴雨下到哪里了,鞠婧祎起诉花椰菜大王二审败诉,巴基斯坦爆炸9名中国公民遇难,杨迪不懂极圈是什么意思,穆青受伤,印度民众抗议缺水警察用水枪驱逐,93岁乡村教师说下辈子还当老师,王者世冠奖金5000万,一诺的兰陵王,宋丹丹演的姥姥,男朋友才是最好的显白单品,巴基斯坦外交部称班车因机械故障爆炸,小象被警方救助还喝了两大壶羊奶,

