2021-09-11,为啥海底捞这么多摄像头,福建仙游6例阳性人员详情公布,虎鲸被圈养42年后开始严重自残,赵丽颖张碧晨合唱星空剪影,20岁男子患痔疮全身失血过半,顶楼3全员下线,再也不敢去掏耳朵了,沙县做成了我吃不起的样子,阿富汗塔利班取消临时政府就职典礼,重庆公安局原局长一审被控受贿4267万,女子鼓动前男友和现男友决斗,帮吴磊看病的医生是陶勇,皮箱藏尸案出租司机被网暴,亚马逊关闭大量刷单电商店铺,警方通报连云港15岁男孩宿舍被打身亡,一张照片能泄露多少隐私,医生建议成人每天最多吃1块月饼,男子路遇车祸救人发现死者是女儿,人生第一次这么想要小钢腿,福岛核电站24个排气装置出现破损,日本一根黄瓜13元,广电总局要求抵制唯颜值的畸形文化,比心APP永久关闭游戏陪玩功能,步步惊心开播十周年,赵文卓唱的不是大艺术家是大武术家吧,心疼刘端端,千书真把秀莲推下海,你发过仅一人可见的朋友圈吗,顶楼大结局,中美两国必须回答好的世纪之问,敖犬不主动退出,福建仙游发现6例核酸检测阳性人员,李宁客服回应陈雨菲被运动鞋划伤,教师节快乐,向佐郭碧婷希望女儿自由长大,红楼梦贾政扮演者去世,和大学喜欢的那个人结婚了,三星堆文物撞脸经典表情包,成都地铁在建工地坍塌4死14伤,当社恐人当上了老师,赵丽颖认出龚俊刘昊然童年照,抗癌博主阿健哥哥宣布其已去世,张智霖喜爱度排名第一,福建莆田疫情防控新闻发布会,赵丽颖丁程鑫是在跳恰恰舞吧,张智霖扭腰遇上张淇流鼻血,德云团综第四期笑出皱纹,发际线高对寸头有多不友好,塔利班展示占领阿富汗军阀豪宅,杭州亚运会倒计时一周年主题活动,

2021-09-11,福建仙游6例阳性人员详情公布,为啥海底捞这么多摄像头,虎鲸被圈养42年后开始严重自残,20岁男子患痔疮全身失血过半,顶楼3全员下线,再也不敢去掏耳朵了,赵丽颖张碧晨合唱星空剪影,许家印回应恒大财富兑付危机,阿富汗塔利班取消临时政府就职典礼,重庆公安局原局长一审被控受贿4267万,男童被喷泉冲至半空摔地后身亡,女子鼓动前男友和现男友决斗,帮吴磊看病的医生是陶勇,皮箱藏尸案出租司机被网暴,警方通报连云港15岁男孩宿舍被打身亡,沙县做成了我吃不起的样子,王靖雯原创下一个好听,医生建议成人每天最多吃1块月饼,男子路遇车祸救人发现死者是女儿,福岛核电站24个排气装置出现破损,亚马逊关闭大量刷单电商店铺,步步惊心开播十周年,一张照片能泄露多少隐私,人生第一次这么想要小钢腿,广电总局要求抵制唯颜值的畸形文化,顶楼大结局,日本一根黄瓜13元,比心APP永久关闭游戏陪玩功能,赵文卓唱的不是大艺术家是大武术家吧,中美两国必须回答好的世纪之问,敖犬不主动退出,德云团综第四期笑出皱纹,张智霖扭腰遇上张淇流鼻血,向佐郭碧婷希望女儿自由长大,福建仙游发现6例核酸检测阳性人员,心疼刘端端,你发过仅一人可见的朋友圈吗,千书真把秀莲推下海,三星堆文物撞脸经典表情包,和大学喜欢的那个人结婚了,抗癌博主阿健哥哥宣布其已去世,红楼梦贾政扮演者去世,赵丽颖丁程鑫是在跳恰恰舞吧,李宁客服回应陈雨菲被运动鞋划伤,张智霖喜爱度排名第一,福建莆田疫情防控新闻发布会,教师节快乐,塔利班展示占领阿富汗军阀豪宅,成都地铁在建工地坍塌4死14伤,福建仙游三地划为中风险区域,

2021-09-11,重庆一对闺蜜公厕遇害,心脏骤停1分钟内人的变化,高考623分外卖小哥已入学报到,男孩当街踹妈妈保安制止反被吼,福建仙游6例阳性人员详情公布,周也抱孩子的熟练程度,一元公益日,为啥海底捞这么多摄像头,虎鲸被圈养42年后开始严重自残,911事件20年,阿富汗塔利班取消临时政府就职典礼,傅首尔 所有的原生家庭都有问题,张碧晨我是来干饭的,男童被喷泉冲至半空摔地后身亡,皮箱藏尸案出租司机被网暴,大连一住户家中发生爆燃致8死5伤,帮吴磊看病的医生是陶勇,丁真社交尴尬症,医生建议成人每天最多吃1块月饼,沙县做成了我吃不起的样子,重庆公安局原局长一审被控受贿4267万,顶楼3全员下线,周生如故和一生一世前后呼应的情节,赵丽颖张碧晨合唱星空剪影,湖人得到王哲林签约权,20岁男子患痔疮全身失血过半,换乘恋爱,一张照片能泄露多少隐私,AG好有钱,男子路遇车祸救人发现死者是女儿,福岛核电站24个排气装置出现破损,孔雪儿被周笔畅套话,这西瓜也太像柚子了,天降水杯插进汽车挡风玻璃,警方通报连云港15岁男孩宿舍被打身亡,女子鼓动前男友和现男友决斗,零糖饮料并不等于没有糖,世界最大吸碳机,全红婵水花消失术训练集锦,再也不敢去掏耳朵了,周笔畅像极了聚会提前到的我本人,敖犬不主动退出,教师节的祝福翻车现场,90婚介所神仙售后,人生第一次这么想要小钢腿,步步惊心开播十周年,和大学喜欢的那个人结婚了,每个人都该会的急救知识,广电总局要求抵制唯颜值的畸形文化,你发过仅一人可见的朋友圈吗,

2021-09-11,高考623分外卖小哥已入学报到,保安脑死亡抢救超48小时不被认定工伤,你能接受舍友的朋友频繁串寝吗,五哈已经录完了一期,赵丽颖中餐厅DNA动了,穿衣会影响人的性格吗,911事件20年,心脏骤停1分钟内人的变化,全红婵水花消失术训练集锦,911后的20年美国怎么了,物业回应将猫吊尸示众,小美人鱼真人电影定档,大连一住户家中发生爆燃致8死5伤,男童被喷泉冲至半空摔地后身亡,福建莆田新增1例本土确诊,李云迪抱了又没完全抱,傅首尔 所有的原生家庭都有问题,皮箱藏尸案出租司机被网暴,2021最后四个月考试日历,美国真的学会应对恐怖主义了吗,周也抱孩子的熟练程度,檀健次中餐厅职业微笑,帮吴磊看病的医生是陶勇,丁真社交尴尬症,男孩当街踹妈妈保安制止反被吼,张碧晨我是来干饭的,这西瓜也太像柚子了,911搜救者和附近人群已确诊约70种癌症,北京首批校外培训机构白名单,阿富汗塔利班取消临时政府就职典礼,钟汉良17岁学生照,周生如故和一生一世前后呼应的情节,半夜着火邻居光着脚砸窗救人,顶楼3全员下线,贵州男子深夜爬树吃蜂蛹被困,孝感再现一保存完好秦汉古墓,灭霸阿姨做蚊虫作息表送顾客,ModelY高性能版涨价1万元,为啥海底捞这么多摄像头,孔雪儿被周笔畅套话,医生建议成人每天最多吃1块月饼,这是未来的花滑冠军吧,老人获他人帮助两天后10倍奉还,汤姆猫回复关注函,赵丽颖张碧晨合唱星空剪影,AG好有钱,湖人得到王哲林签约权,福建仙游6例阳性人员详情公布,沙县做成了我吃不起的样子,虎鲸被圈养42年后开始严重自残,

2021-09-11,哥哥假装被绊倒妹妹开心跺脚,小姑娘一做数学就眼睛过敏,911事件华裔空姐通话录音曝光,张雨绮李柄熹的吻跨越黄河,你永远想不到在春熙路能遇到谁,五哈已经录完了一期,如何看待网诈瞄准年轻人,911事件20年,保安脑死亡抢救超48小时不被认定工伤,911后的20年美国怎么了,张帅晋级美网女双决赛,李莎旻子 不努力连输的资格都没有,全世界的闺蜜都是这样吗,终于知道鱼为什么怕猫了,狗子的编制不是白拿的,出生在教师世家是什么体验,何泓姗晒九龄受伤妆,隔壁老樊李莎旻子因即兴弹唱起分歧,如何判断一个人得了心梗,全红婵水花消失术训练集锦,美国真的学会应对恐怖主义了吗,周扬青罗昊重回朋友关系,李兰迪醉酒反应太真实,佟丽娅上班用跑的,被许嵩薛之谦戴佩妮导师课笑死,货拉拉乘客坠亡案司机获释后发声,网友在三星堆里集齐了一座动物园,高考623分外卖小哥已入学报到,耳根子软的人不要来西藏,2021最后四个月考试日历,阿富汗塔利班取消临时政府就职典礼,汶川地震截肢女孩获授全国五一劳动奖章,李云迪抱了又没完全抱,小美人鱼真人电影定档,广州新增1例本土无症状感染者,你能接受舍友的朋友频繁串寝吗,朱一龙黄志忠互晒峰爆剧照,学生回应快递多到把路堵死,付双双强吻秦贺博,俄罗斯外交部就俄选举召见美国大使,男子自学技术黑进500多组摄像头偷窥,父母该不该为了孩子放弃工作,穿衣会影响人的性格吗,傅首尔 所有的原生家庭都有问题,心脏骤停1分钟内人的变化,福建莆田新增1例本土确诊,大连一住户家中发生爆燃致8死5伤,911搜救者和附近人群已确诊约70种癌症,当机器人跟狗狗抢食物,沙县做成了我吃不起的样子,

2021-09-11,男子报警称4个妖精放火烧了他家,出生6天宝宝被月嫂摔成颅骨骨折,女子疑整形失败院方称解剖才能证明,披荆斩棘的老师,阿朵谈李莎旻子不自信的原因,张雨绮李柄熹的吻跨越黄河,耳根子软的人不要来西藏,超玩星驾到,室友睡过头你会叫醒他们吗,90后不认识单田芳,911事件20年,构建清朗网络文化生态自律公约,还以为周杰伦去军训了,福建莆田发现6人核酸阳性,谈恋爱后要融入对方的朋友圈吗,14家平台将限流禁言清理6类账号,微博抖音等将共享严重违规账号信息,隔壁老樊李莎旻子因即兴弹唱起分歧,许嵩请村民吃长桌宴,小姑娘一做数学就眼睛过敏,911事件华裔空姐通话录音曝光,反诈骗已经刻在民警DNA里了,皮箱藏尸案嫌疑人朋友圈,周深回应利路修说自己会武功,孟子义朋友问男嘉宾在立完美人设吗,超新星运动会上班图,行星地质学女博士回应报考社区干事,这香油放了但又没完全放,警方回应多名未成年男生暴力霸凌,全红婵预赛第一晋级半决赛,全运会跳水上演神仙打架,911后的20年美国怎么了,何泓姗晒九龄受伤妆,上个学把孩子愁成什么样了,演出行业协会联合多平台发起自律公约,南京搜爆犬要接受拒食训练,百色地震,双探爷青回阵容,刘宇蓝色赛车服造型,东北人说话有多爱加的,显微镜下的一百块有多美,终于知道鱼为什么怕猫了,李莎旻子 不努力连输的资格都没有,学生回应快递多到把路堵死,男孩放学没人接请求店主送回家,狗子的编制不是白拿的,五哈已经录完了一期,张家界天门山的索道有多刺激,哥哥假装被绊倒妹妹开心跺脚,你三叔还是你三叔,

2021-09-11,福建疫情,男子报警称4个妖精放火烧了他家,熬夜的七大好处,弟弟原来是文字隐藏杀手,出生6天宝宝被月嫂摔成颅骨骨折,80后女友当奶奶小伙要回彩礼,大一准备考研会不会太早,可乐土豆鸡煲,911事件20年,构建清朗网络文化生态自律公约,你能接受比你矮的男朋友吗,莆田此轮疫情报告24例核酸阳性,河北一羽绒加工厂发生窒息事故致6死,相处多久适合结婚,还以为周杰伦去军训了,显微镜下的一百块有多美,福建仙游疫情疑似源头病例曾串门,44岁辅警为保护战友遭遇车祸殉职,每日虐腹训练,乱港团体香港教协解散,金晨顶碗,初判莆田此次疫情毒株为德尔塔毒株,牛气满满的哥哥古装群像,张雨绮李柄熹的吻跨越黄河,食堂的鸡蛋馅包子有多离谱,广东一女子当街持刀砍伤丈夫,佟丽娅科普新疆舞翻腕儿,皮箱藏尸案嫌疑人朋友圈,C罗重返曼联首秀,反诈骗已经刻在民警DNA里了,阿朵谈李莎旻子不自信的原因,南北方室友的差异大吗,试驾车连人带车从3楼坠落,许嵩请村民吃长桌宴,隔壁老樊李莎旻子因即兴弹唱起分歧,谭警官经典名场面,谈恋爱后要融入对方的朋友圈吗,北京天通苑小区的人口比冰岛多,员工回应女子哭诉新车被撞,福建莆田发现6人核酸阳性,90后不认识单田芳,起底美国冠状病毒之父与德堡的关系,小姑娘一做数学就眼睛过敏,兰州文化一定要来感受下,工信部要求限期解除屏蔽网址链接,女子疑整形失败院方称解剖才能证明,莆田2地高风险5地中风险,超新星还有赛车项目,微博抖音等将共享严重违规账号信息,张桂梅的学生回到华坪女高教书,

