2021-05-26,官方回应击毙外逃老虎原因,易烊千玺入围华鼎奖最佳男主,为袁隆平拍照24年存500多张照片,在火锅店等位碰到吴磊,和不喜欢的人结婚是啥体验,小区电梯突然加速撞顶楼致1死,普京与拜登将于6月16日举行会晤,INTO1应援色和粉丝名,LV老板重返世界首富,中国女排 韩国女排,王珞丹 退圈,曝光彦希偷戒指的店家道歉,小鬼王琳凯方回应音乐节表演争议,徐仁国朴宝英吻戏,广州夜空画出袁隆平,台北市长称8成新冠确诊者不用住院,吴磊脱了一件衬衫还有一件,发现自己生性薄凉的瞬间,张歆艺分享儿子可爱趣事,被医学专业耽误的影帝,帝皇书,被姜云升笑死,那些最毁三观的广告,黄小蕾 没有人是天生的气氛担当,李斯丹妮 黑暗是艺人的必修课,男子冒充美女主播骗打赏超1000万,喻言回应缺席节目录制,黄景瑜跳情人,辣目洋子社死现场,中国女排战胜韩国女排,特斯拉已在中国建立数据中心,龙王流萤成婚,甘肃马拉松遇难者家属获赔95万元,现在的直播到了什么程度,美国人将蝉做成巧克力,王梦洁躲一传,女孩247天拍摄56个民族服饰,夫妻拒养听障儿被判不许离婚,原来荔枝也有排名,皓衣行剧照,两只蜜蜂合伙拧开瓶盖,华鼎奖提名名单,长津湖杀青,追爱吧哥哥 男星追素女,安徽一工地发生溺水事故4人死亡,世界女排联赛,2021LPL夏季转会期,深圳本轮疫情累计报告7例无症状,奔跑吧导演清空微博,遇龙,

2021-05-26,官方回应击毙外逃老虎原因,易烊千玺入围华鼎奖最佳男主,中国女排 韩国女排,和不喜欢的人结婚是啥体验,为袁隆平拍照24年存500多张照片,普京与拜登将于6月16日举行会晤,梁博对声阔表态,INTO1应援色和粉丝名,台北市长称8成新冠确诊者不用住院,王珞丹 退圈,LV老板重返世界首富,徐仁国朴宝英吻戏,小区电梯突然加速撞顶楼致1死,曝光彦希偷戒指的店家道歉,中国女排战胜韩国女排,甘肃马拉松遇难者家属获赔95万元,发现自己生性薄凉的瞬间,吴磊脱了一件衬衫还有一件,被医学专业耽误的影帝,黄小蕾 没有人是天生的气氛担当,张歆艺分享儿子可爱趣事,帝皇书,那些最毁三观的广告,男子冒充美女主播骗打赏超1000万,被姜云升笑死,李斯丹妮 黑暗是艺人的必修课,美国人将蝉做成巧克力,广州夜空画出袁隆平,夫妻拒养听障儿被判不许离婚,世界女排联赛,辣目洋子社死现场,龙王流萤成婚,喻言回应缺席节目录制,黄景瑜跳情人,两只蜜蜂合伙拧开瓶盖,女孩247天拍摄56个民族服饰,安徽一工地发生溺水事故4人死亡,特斯拉已在中国建立数据中心,王梦洁躲一传,小鬼王琳凯方回应音乐节表演争议,赵立坚说中俄关系百炼成金,原来荔枝也有排名,华鼎奖提名名单,现在的直播到了什么程度,追爱吧哥哥 男星追素女,2021LPL夏季转会期,全国哪里能看到超级红月亮,皓衣行剧照,深圳本轮疫情累计报告7例无症状,长津湖杀青,

2021-05-26,大四学生知网账号被盗后现电商平台,小米被移出美国制裁清单,吴孟超遗体告别,当面试官问你离职的原因,和不喜欢的人结婚是啥体验,以袁隆平Q版形象为主角的科普动画片,许凯蔚蓝风大片,广东新增3例本土无症状,易烊千玺入围华鼎奖最佳男主,官方回应击毙外逃老虎原因,中国超德国成英国最大进口来源国,中国钓鱼技术协会总教练是怎么钓鱼的,中国女排 韩国女排,徐仁国朴宝英吻戏,LV老板重返世界首富,晋商消金致歉,被学医耽误了的演员,范丞丞的袜子穿反了,专家称利用孩子做美妆博主涉嫌违法,黑暗中看手机对眼睛伤害有多大,他说我不过就是一个吴孟超,发现自己生性薄凉的瞬间,那些最毁三观的广告,陆啸姜可乐牛奶吻,被姜云升笑死,张歆艺分享儿子可爱趣事,31省区市新增13例确诊,冯小刚已向华谊支付1.68亿业绩补偿,辣目洋子社死现场,五月的青春,普京与拜登将于6月16日举行会晤,深圳顶级学区房最高下调55万,黄小蕾 没有人是天生的气氛担当,帝皇书,被医学专业耽误的影帝,甘肃马拉松遇难者家属获赔95万元,为袁隆平拍照24年存500多张照片,INTO1应援色和粉丝名,黄景瑜跳情人,凯尔特人 篮网,男子报复社会行凶致14人受伤,龙王流萤成婚,李斯丹妮 黑暗是艺人的必修课,中国疫苗接种增长动态图,两只蜜蜂合伙拧开瓶盖,男子冒充美女主播骗打赏超1000万,原来荔枝也有排名,曝光彦希偷戒指的店家道歉,王珞丹 退圈,台北市长称8成新冠确诊者不用住院,

2021-05-26,广州疫情,助理跪地为王子文穿鞋,吴孟超遗体身覆党旗鲜花丛中安眠,韩美娟 下了岛都在相互抢资源,杨和苏租了赵英俊住所,运费过敏,戏精出道计划,HM因童装不符标准被罚,这个世界不小心就会遇见恶魔,吴孟超遗体告别,我国5G手机终端达3.1亿,冯小刚已向华谊支付1.68亿业绩补偿,郝富申恋情,纽约市长下跪9分29秒纪念弗洛伊德,大四学生知网账号被盗后现电商平台,星野源宣布结婚后首现身,基金走势,赵小棠为喻言庆生,若东京奥运停办损失将达1.8万亿,美国至少10262人接种疫苗后检测阳性,小米被移出美国制裁清单,黑龙江东宁一楼体发生爆炸致2死5伤,马嘉祺郑州47中宣传片,邓伦讲戏专业,72岁患罕见病老人去世捐献遗体,浓眉恶意犯规,男子报复社会行凶致14人受伤,当面试官问你离职的原因,被学医耽误了的演员,湖人 太阳,官方回应击毙外逃老虎原因,如何维持好一段关系,范丞丞的袜子穿反了,御赐小仵作,以袁隆平Q版形象为主角的科普动画片,普京与拜登将于6月16日举行会晤,当代年轻人防剁手正确方式,中国疫苗接种增长动态图,黑暗中看手机对眼睛伤害有多大,他说我不过就是一个吴孟超,长沙数百架无人机点亮禾下乘凉梦,吴孟超曾将600万奖励全用于科研,泰国坠崖案法院认定不构成蓄意谋杀,钟南山为吴孟超送来花圈挽联,多国代表感谢中国提供新冠疫苗,利路修自拍照,员工拒绝钉钉打卡遭开除索赔近60万,网易云人格主导色,和不喜欢的人结婚是啥体验,深圳顶级学区房最高下调55万,

2021-05-26,王大陆蔡卓宜拥吻,广州疫情,雄安被确认为婚俗改革实验区,偶遇张艺兴王思聪打台球,今天刷朋友圈的我,助理跪地为王子文穿鞋,戏精出道计划,印度恒河边数百沙埋尸体清理现场,特斯拉或将面临10亿元巨额索赔,钟南山为吴孟超送来花圈挽联,我国5G手机终端达3.1亿,丁真的小马珍珠跑第一了,我爱记歌词海峰去世,心疼陈越,泰国坠崖案法院认定不构成蓄意谋杀,运费过敏,王凯为张佳宁庆生,韩美娟 下了岛都在相互抢资源,网易云人格主导色,网易云人格主导色遭微信屏蔽,张常宁全英文接受采访,第一届电竞专业本科生毕业,孙女隔空喊话爷爷误以为在门口,杨和苏租了赵英俊住所,郝胡be,吴孟超遗体告别,怦然心动20岁,为什么会有人将狗称作儿子,员工拒绝钉钉打卡遭开除索赔近60万,基金走势,官方回应击毙外逃老虎原因,密室大逃脱,郝富申恋情,恋爱中你是主动型吗,吴孟超遗体身覆党旗鲜花丛中安眠,普京与拜登将于6月16日举行会晤,冯小刚已向华谊支付1.68亿业绩补偿,利路修自拍照,反内卷就是竞争不过吗,年轻人的仪式感,纽约市长下跪9分29秒纪念弗洛伊德,我的小尾巴收官,12所高校入选未来技术学院,林峯吵架后穿短裤追回张馨月,这个世界不小心就会遇见恶魔,烟草每年使我国100多万人失去生命,HM因童装不符标准被罚,被学医耽误了的演员,黑龙江东宁一楼体发生爆炸致2死5伤,小米被移出美国制裁清单,

2021-05-26,张翰曾三年半不拍吻戏,论文查重费一年内暴涨10倍,中方宣布制裁1名美国官员,陈建斌和蒋勤勤冷战带了一星期墨镜,李昇基方承认与李多寅恋情,今天刷朋友圈的我,奶奶问芝士葡萄好喝吗,台北疫苗仅剩2瓶,吴孟超灵车回生前工作医院绕行一周,广州疫情,王大陆蔡卓宜拥吻,导演回应助理跪地为王子文穿鞋,偶遇张艺兴王思聪打台球,比狗困 比猪饿 比驴累,广州海珠发现1例核酸阳性,北大教授鼓励毕业生留在大城市,这是中国大力女都奉顺吧,北京各大医院的擅长科室,网易云人格主导色遭微信屏蔽,网易云人格主导色,林峯吵架后穿短裤追回张馨月,这么甜的花絮居然第一次见,全国已发现660多种外来入侵物种,电梯底层冲顶身亡女业主家属发声,张文宏19分钟全英文演讲,胡歌生图,杀人犯潜逃17年被抓时刚提豪车,人民币对美元汇率逼近6.3元时代,有充足证据表明电子烟会危害健康,我国5G手机终端达3.1亿,北京两机场230余架次航班取消,沸腾之夜阵容,我爱记歌词海峰去世,丁真的小马珍珠跑第一了,赵立坚说核污水排海是对人类犯罪,山海情凌教授原型说我不是被坑去的,鄂尔多斯中心医院9名新生儿感染致3死,定金内卷,SMLZ加入UP,秦海璐拒绝拍吻戏,助理跪地为王子文穿鞋,中国孕妇泰国坠崖案二审改判,假发小镇一年产值28亿,密室大逃脱,韩美娟 下了岛都在相互抢资源,分手后宠物怎么办,深圳五和,雄安被确认为婚俗改革实验区,黄金爆汁菠萝烤翅,烟草每年使我国100多万人失去生命,

2021-05-26,1小时打疫苗60人护士手磨出血,张艺兴EXO回归预告照,超级红月亮,中国玉有多美,胡耘豪孙恩静结婚,今天刷朋友圈的我,易烊千玺腿部受伤,多少岁不能过六一,钱学森的入党申请书,连续咬伤21人恶犬已抓获,奶奶问芝士葡萄好喝吗,国台办质问台当局大陆疫苗要还是不要,迪丽热巴手臂线条,王大陆蔡卓宜拥吻,当事人回应泰国坠崖案二审改判,最美背影找到了,中国女排 日本女排,赵奕欢 单膝跪地求婚不是男生的专属,黄奕随手一牵就是红线,卑微内娱粉be like,温州银行,中国孕妇泰国坠崖案二审改判,青岛大学回应保安殴打学生,常华森 天官赐福,牙医的夸人方式,机智的恋爱生活开播,高中时代喜欢的人要追吗,过程很咸但结果很甜,郝富申 张云琪,基金上涨是加仓还是减仓,当众拒绝没有好感的异性有错吗,网易云人格主导色遭微信屏蔽,张翰曾三年半不拍吻戏,超级红月亮拍照大赛,赵立坚说无法呼吸的呐喊仍在美国回响,Langx加入TT,比狗困 比猪饿 比驴累,中方宣布制裁1名美国官员,袁克勤为日方从事间谍活动被查,吴亦凡 什么是翱翔,吴孟超80岁学生为吴老送别,御赐小仵作,台北疫苗仅剩2瓶,62名白血病儿家长在燕郊送外卖,陈建斌和蒋勤勤冷战带了一星期墨镜,北京彩虹,电梯底层冲顶身亡女业主家属发声,Face ID 可爱的脑洞,遇龙,天津大雨,

