2021-07-09,宁静误入丁真连线中国女排现场,女儿被妈妈用农药焗头驱虱进ICU,全网最简单录取通知书,杨凯雯 我是奇闻的雯,插上吸管就能喝的水蜜桃一个能卖128元,龚俊张慧雯cp感,明星摩尔第二季,九旬老号兵唇上仍有号嘴印,心动的信号4,女车主为女骑手深夜打灯照路5公里,4年7次起诉离婚女子提起第8次诉讼,杜海涛 有问题就要重视且彻底解决,邱天 脸受伤,南京免费帮家长暑期带娃,青海湖现水上沙漠奇观,我国22个新冠疫苗进入临床试验阶段,李雪琴 恋爱关系本质上是人际关系,网名被爸妈叫出来有多尴尬,机智的医生生活,北京闪电,抱鲸睡觉潜水员发声,林生斌发文回应,都美竹 吴亦凡,Angelababy说小心机是爱情保鲜剂,福原爱江宏杰正式离婚,商务部敦促个别国家纠正无理打压新疆棉,如何看待林生斌回应再婚生女争议,吴亦凡方律师声明,彭小苒演的田雨,毛晓彤侧颜线条,当飞机飞越彩虹,张钧甯阮经天连麦,张新成原声视频告别江熠,父亲求助消防员瞬间凑齐救命血,王一博方起诉造谣者,湖南藏香猪排队跳水,东京奥运会部分赛事以空场形式举办,孩子沉迷手机短视频该如何应对,天津多家银行提高首套房贷利率,北京彩虹,海地总统身中12枪,大爷偷风扇犯选择困难症,变成你的那一天收官,青岛外卖小哥帮崩溃程序员写代码,中国渔民到底有多牛,没有腰的大熊猫长什么样,千古玦尘,大学的人脉真的很重要吗,中科大通知书送新生父母科学家勋章,厦门疫情,

2021-07-09,宁静误入丁真连线中国女排现场,插上吸管就能喝的水蜜桃一个能卖128元,全网最简单录取通知书,杨凯雯 我是奇闻的雯,龚俊张慧雯cp感,女儿被妈妈用农药焗头驱虱进ICU,被青蛇劫起姐妹情感动到,九旬老号兵唇上仍有号嘴印,青海湖现水上沙漠奇观,4年7次起诉离婚女子提起第8次诉讼,我国22个新冠疫苗进入临床试验阶段,杜海涛 有问题就要重视且彻底解决,南京免费帮家长暑期带娃,女车主为女骑手深夜打灯照路5公里,心动的信号4,当飞机飞越彩虹,张钧甯希望40岁结婚,李雪琴 恋爱关系本质上是人际关系,网名被爸妈叫出来有多尴尬,机智的医生生活,天津多家银行提高首套房贷利率,林生斌发文回应,都美竹 吴亦凡,Angelababy说小心机是爱情保鲜剂,如何看待林生斌回应再婚生女争议,福原爱江宏杰正式离婚,毛晓彤侧颜线条,吴亦凡方律师声明,彭小苒演的田雨,北京闪电,商务部敦促个别国家纠正无理打压新疆棉,抱鲸睡觉潜水员发声,父亲求助消防员瞬间凑齐救命血,大爷偷风扇犯选择困难症,湖南藏香猪排队跳水,中国渔民到底有多牛,邱天 脸受伤,孩子沉迷手机短视频该如何应对,张新成原声视频告别江熠,没有腰的大熊猫长什么样,海地总统身中12枪,张钧甯阮经天连麦,你微笑时很美,千古玦尘,中国医生,东京奥运会部分赛事以空场形式举办,青岛外卖小哥帮崩溃程序员写代码,大学的人脉真的很重要吗,北京彩虹,厦门疫情,

2021-07-09,大蛇偷吃被抓后吐出整只大鹅,昆明一办公室内长出巨大蘑菇,紫薇被榜一大哥治好眼睛,解锁盛夏绝美自驾游,当一个有趣的人学会了种菜,胡歌 王晓晨,湖南大学,郭麒麟曾把贴身小梳子借给了宋祖儿,宁静误入丁真连线中国女排现场,中国高铁版贪吃蛇,我国22个新冠疫苗进入临床试验阶段,女子扫陌生人二维码被敲诈22万,全网最简单录取通知书,宁静给丁真擦脸的手法,FPX首发调整公告,插上吸管就能喝的水蜜桃一个能卖128元,bw,摩尔庄园,张钧甯希望40岁结婚,李雪琴 恋爱关系本质上是人际关系,九旬老号兵唇上仍有号嘴印,林生斌发文回应,Angelababy说小心机是爱情保鲜剂,云南虎跳峡进入最佳观赏期,龚俊张慧雯cp感,杨凯雯 我是奇闻的雯,展羽经纪公司声明,内向算不算性格缺陷,官方回应西安钟楼夜间冲水降温,抱鲸睡觉潜水员发声,商务部敦促个别国家纠正无理打压新疆棉,都美竹 吴亦凡,网名被爸妈叫出来有多尴尬,许凯唱rap,官方免费托管班能解决暑期看护问题吗,云南新增8例本土确诊,吴亦凡方律师声明,福原爱江宏杰正式离婚,如何看待林生斌回应再婚生女争议,雄鹿vs太阳,海地总统身中12枪,怀疑自己是外星人的证据,原来我是同学眼里偶像女主,和平精英,机智的医生生活,网友拍到中国空间站从头顶飞过,90后女孩成狙击尖兵,女儿被妈妈用农药焗头驱虱进ICU,南京免费帮家长暑期带娃,心动的信号4,

2021-07-09,昆明一办公室内长出巨大蘑菇,怀3胎孕妇产前心脏骤停获救,路人头发做到一半去看刘诗诗,基金大跌,大蛇偷吃被抓后吐出整只大鹅,当着狗子面别提没考上,硬核凭实力,女生科目三模拟考被考官咳嗽吓懵,原来我是同学眼里偶像女主,父亲负债送12岁儿子去马德里竞技,我国22个新冠疫苗进入临床试验阶段,陈意涵曾撮合张钧甯和阮经天,胡歌方辟谣与王晓晨结婚,紫薇被榜一大哥治好眼睛,安徽发现一名核酸检测阳性人员,近视手术前必须做好严格术前检查,湖南大学,宁静给丁真擦脸的手法,网友拍到中国空间站从头顶飞过,准大学生扎堆摘眼镜,bw,林生斌亡妻哥哥发声,郭麒麟曾把贴身小梳子借给了宋祖儿,95后女生带七旬奶奶做穿搭博主,100万存银行5年后剩1元,怀疑自己是外星人的证据,林生斌 大儿子,安徽疫情,它好像想要你全部寿命,李梁,商务部敦促个别国家纠正无理打压新疆棉,林生斌发文回应,都美竹 吴亦凡,魔道祖师动画三周年,摩尔庄园,百岁老人记忆困在3岁把女儿当妈妈,把菜做成了考古现场,成都90后妹子水下打太极,微软将为员工发放1500美元奖金,安徽核酸阳性者曾坐高铁徐州下车,海地总统身中12枪,黑寡妇,广西水果水葡萄,不得强制要求学生参加暑期托管,宁静误入丁真连线中国女排现场,我们的新生活演员阵容,当一个有趣的人学会了种菜,美国男篮定妆照,中国高铁版贪吃蛇,山西6名黄河溺水学生正搜救,

2021-07-09,怀3胎孕妇产前心脏骤停获救,王尼玛恶搞奥特曼一案将开庭,刘星家的伙食到底有多好,紫薇外公也太骄傲了,深圳公司300元一次招人捐粪便,蔡徐坤看经纪人来电的反应,被青蛇劫起姐妹情感动到,杨玏王玉雯挽手搂腰,上海迪士尼乐园票价上调,新疆网红女副局长策马浴河摔河里,两名暗杀海地总统嫌犯被捕现场,清华大学推出限定雪糕,小伙婚前8块腹肌婚后胖80斤,急寻7月7日G7610次同乘人员,路人头发做到一半去看刘诗诗,陈意涵曾撮合张钧甯和阮经天,海绵宝宝结婚了,杨迪做客宋妍霏家遭遇社死现场,希林娜依高侧颜,大学四年对室友的客气程度,女生科目三模拟考被考官咳嗽吓懵,肖战一次性做了65个俯卧撑,林生斌亡妻哥哥发声,不得强制要求学生参加暑期托管,这就是小说里的东方美人吧,基金大跌,林生斌 大儿子,肖战笑到失声,教育部支持探索开展暑期托管服务,甘肃农田发现鲎虫,要自尊自强不要乱港祸港,黑寡妇,霍言打针 二哈崩溃现场,收费站回应拉苹果蕉被收千元过路费,豆瓣崩了,胡歌方辟谣与王晓晨结婚,杨超越民族风造型,中国医生,詹姆斯祝贺保罗,孙悟空能硬刚灭霸吗,暗杀海地总统嫌犯均穿战术靴,红楼梦里令人垂涎欲滴的美食,冰镇雪碧小番茄,一个人住也太爽了吧,法医秦明之读心者杀青,徐翔出狱,仙气蜜桃牛奶绵绵冰,小学也要写毕业论文了,高铁晚点,最后一届90后毕业生求职现状,

2021-07-09,王彦霖艾佳妮婚礼伴手礼,上海100多个小区出现貉,女子试戴手表不慎滑落被判赔17800元,书桓为什么选依萍不选如萍,一个人住也太爽了吧,蔡徐坤鞠婧祎左其铂早年同框,决战平安京花鸟卷,原来战狼里的情节是真的,易烊千玺演技,统一饮料开盖中奖率不实被罚6万,白宫称美国遵循一个中国政策,紫薇外公也太骄傲了,孩子被喷泉水柱冲起数米腾空翻转,上海的爷爷奶奶有多会穿,1旅客入境带了9行李箱化妆品,男子扶摔倒老人反被讹,海绵宝宝结婚了,赵露思初恋感写真,林彦俊语音,杨迪做客宋妍霏家遭遇社死现场,刘青松因病暂时缺席比赛,都美竹准备报案,林生斌律师回应筹建基金会,宋祖儿腰臀比例,林生斌亡妻哥哥发声,肖战一次性做了65个俯卧撑,林生斌 大儿子,任嘉伦皆大欢喜的名字任国嘉,日本宣布东京都第四次进入紧急状态,王尼玛恶搞奥特曼一案将开庭,暗杀海地总统嫌犯均穿战术靴,刘星的穿衣图鉴,杨玏王玉雯挽手搂腰,中国医生,深圳公司300元一次招人捐粪便,谭松韵演的村官黄思齐,肖战笑到失声,吴磊侯明昊斗嘴好幼稚,把奶奶拍得像p的一样,宁静晒与丁真的合照,两名暗杀海地总统嫌犯被捕现场,没想到作家也不爱上班,美黑人女子洗劫式打砸亚裔店铺,山东大姐用万张煎饼制成锦绣花球,江西上饶现龙吸水现象,小伙婚前8块腹肌婚后胖80斤,黑寡妇上线,当搜救犬看到休假归队的训导员,这些症状显示你得了空调病,北京WB 东莞Wz,

2021-07-09,儿子被北大录取爸爸凡尔赛发言,上海一车库天价车祸损失或千万,陆柯燃因工作没见到妈妈最后一面,字节跳动8月将取消大小周,女子试戴手表不慎滑落被判赔17800元,书桓为什么选依萍不选如萍,明星摩尔第二季,马嘉祺手机壁纸是加油,王彦霖艾佳妮婚礼伴手礼,把奶奶拍得像p的一样,外交部回应慰安妇受害者展览被迫中止,一个人住也太爽了吧,上戏学生跳入雨中舞蹈,山西6名黄河失联学生5人已遇难,南京大学回应被质疑不延聘博导,原神新版本全球同步直播,原来战狼里的情节是真的,杨幂高马尾百褶裙造型,18岁的金莎,阚清子人间红娘,取消大小周会成为趋势吗,英国计划禁止烹煮活龙虾,都美竹准备报案,林生斌律师回应筹建基金会,怎么看都美竹再次曝光吴亦凡,戚薇晒驾照,教科书式的扁平足,林生斌 大儿子,宋祖儿腰臀比例,林彦俊语音,1旅客入境带了9行李箱化妆品,白宫称美国遵循一个中国政策,中国医生,爸爸的执行力能有多夸张,赵露思初恋感写真,俄外交部发言人用中文说撸起袖子加油干,蔡徐坤鞠婧祎左其铂早年同框,居民报复邻居连开五年震楼器,肖战一次性做了65个俯卧撑,济南暴雨,千古玦尘,暗杀海地总统嫌犯均穿战术靴,西安暴雨,林墨军训合照,北辙南辕定档,南京晚霞,萌探探探案版小欢喜,JingYi的德莱文,爷爷把雨衣给老伴自己扛箱子,紫薇外公也太骄傲了,

2021-07-09,陶虹 不要拿生命来威胁妈妈,上海一车库天价车祸损失或千万,儿子被北大录取爸爸凡尔赛发言,解锁盛夏绝美自驾游,朴灿烈吧原吧主被拘留,中国人民银行宣布降准0.5个百分点,蔡徐坤 那我走,三孩时代的养娃技巧,居民报复邻居连开五年震楼器,向往的图书馆开馆,书桓为什么选依萍不选如萍,中国成功发射钟子号卫星星座02组卫星,湖南大学湘潭大学发布联合声明,陆柯燃因工作没见到妈妈最后一面,字节跳动8月将取消大小周,周奇瘦回方一凡,95后小伙在游戏里建了一个广州,蓝盈莹金晨演姐妹,取消大小周会成为趋势吗,顶楼3,把奶奶拍得像p的一样,美国感染人数猛增致大量企业停工,都美竹准备报案,杨幂高马尾百褶裙造型,怎么看都美竹再次曝光吴亦凡,马子佳麦穗约会,18岁的金莎,朱志鑫直播,当北京人的语音转为文字,13岁女孩荒岛求生两天崩溃,足球比赛中竟然还有蓝牌,外交部回应慰安妇受害者展览被迫中止,小时候烦唐僧的原因,王彦霖艾佳妮婚礼伴手礼,这些小孩怎么都似曾相识,蔡徐坤2021个人巡回演唱会,谁是宝藏歌手,云南68名同学被北大清华预定,LWX打辅助,人生的第一份工作有多重要,宋祖儿腰臀比例,空间站机械臂如何与目标适配器对接,用牙刷刷小猫咪的额头,中国空间站和北斗七星同框,教科书式的扁平足,养边牧的正确打开方式,如何看待使用震楼器反击,6个方法降低胆固醇,异物入眼时切勿随手揉,萌探探探案版小欢喜,

