2021-06-03,中国共产党组织工作条例,郎平眼睛肿了,摩尔庄园,理想生活狂欢季,嘉人群像照 姬圈盛宴,长沙一律所因收费过低被警告处分,高圆圆张鲁一演夫妻,石恩隆 聊天记录,华为P50,唐嫣的腿yyds,浙江男子打110举报自己酒驾,吴亦凡 都美竹,刘诗诗杨幂坐一起,衡水中学回应学霸演讲视频,饭店员工给17棵行道树投毒,来自农村需要自卑吗,王一博 我的发型我想做就去做,张雨绮红毯走出谐星的感觉,特朗普自称将于今年8月重回白宫掌权,需要支付违约金的offer,HarmonyOS界面,孙俪晒与王雯琴合照,倪妮抬眉,象韵洁 他就是单纯渴望爱情大男孩,华为为什么坚持鸿蒙系统,广州首例确诊郭阿婆将出院,梁洁女皇造型,嘉人女性影响力之夜,黄景瑜演技,狗狗偷吃外卖被教育后一脸委屈,谭维维吉克隽逸袁娅维张碧晨合唱,杨幂半面公主切,北大回应韦东奕走红网络,没想到打疫苗也社死,中国女排 土耳其女排,袁隆平事迹入选语文教材,瑞丽抓获一挖洞钻入偷渡入境人员,嘉人新主持尬,王一博直播状态,嘉人深V内卷,华为鸿蒙发布会,广州一大叔坐地铁口罩武装到眼,当我把全班同学写进小说里,自卑型人格有多累,哪些食物可以护眼,女生因过度吃甜食近视1500度,家中积水过膝男子淡定看动画片,建议免费为中学女生接种HPV疫苗,山东一养老院院长恐吓给老人打哑巴针,体育总局暂停山地越野等赛事,

2021-06-03,摩尔庄园,长沙一律所因收费过低被警告处分,特朗普自称将于今年8月重回白宫掌权,华为WATCH3开启预售,石恩隆 聊天记录,HarmonyOS界面,王一博直播状态,恋爱滤镜,张雨绮红毯走出谐星的感觉,华为P50,中国共产党组织工作条例,浙江男子打110举报自己酒驾,吴亦凡 都美竹,高圆圆张鲁一演夫妻,需要支付违约金的offer,广州首例确诊郭阿婆将出院,饭店员工给17棵行道树投毒,张天爱 今天是张公子,庆怜 我不喜欢标准体重概念,郎平眼睛肿了,嘉人女性影响力之夜,华为鸿蒙发布会,唐嫣的腿yyds,嘉人群像照 姬圈盛宴,刘诗诗杨幂坐一起,倪妮抬眉,北大回应韦东奕走红网络,王一博 我的发型我想做就去做,象韵洁 他就是单纯渴望爱情大男孩,象群距昆明晋宁仅300米,爱上特种兵,狗狗偷吃外卖被教育后一脸委屈,华为为什么坚持鸿蒙系统,瑞丽抓获一挖洞钻入偷渡入境人员,哪些食物可以护眼,顶楼3预告,建议免费为中学女生接种HPV疫苗,梁洁女皇造型,衡水中学回应学霸演讲视频,来自农村需要自卑吗,家中积水过膝男子淡定看动画片,中国女排 土耳其女排,山东一养老院院长恐吓给老人打哑巴针,女生因过度吃甜食近视1500度,邓恩熙张凌赫cp感,没想到打疫苗也社死,广州一大叔坐地铁口罩武装到眼,袁隆平事迹入选语文教材,自卑型人格有多累,当我把全班同学写进小说里,

2021-06-03,摩尔庄园,长沙一律所因收费过低被警告处分,王一博直播状态,龚俊代言雪花马尔斯绿,石恩隆 聊天记录,特朗普自称将于今年8月重回白宫掌权,郎平眼睛肿了,浙江男子打110举报自己酒驾,张雨绮红毯走出谐星的感觉,HarmonyOS界面,中国共产党组织工作条例,吴亦凡 都美竹,高圆圆张鲁一演夫妻,饭店员工给17棵行道树投毒,广州首例确诊郭阿婆将出院,华为P50,张天爱 今天是张公子,黄景瑜跟李沁学自拍,庆怜 我不喜欢标准体重概念,华为为什么坚持鸿蒙系统,瑞丽抓获一挖洞钻入偷渡入境人员,唐嫣的腿yyds,嘉人群像照 姬圈盛宴,刘诗诗杨幂坐一起,山东一养老院院长恐吓给老人打哑巴针,需要支付违约金的offer,王一博 我的发型我想做就去做,衡水中学回应学霸演讲视频,狗狗偷吃外卖被教育后一脸委屈,家中积水过膝男子淡定看动画片,中国女排 土耳其女排,象韵洁 他就是单纯渴望爱情大男孩,象群距昆明晋宁仅300米,北大回应韦东奕走红网络,顶楼3预告,建议免费为中学女生接种HPV疫苗,广州一大叔坐地铁口罩武装到眼,梁洁女皇造型,来自农村需要自卑吗,当我把全班同学写进小说里,邓恩熙张凌赫cp感,倪妮抬眉,爱上特种兵,没想到打疫苗也社死,哪些食物可以护眼,女生因过度吃甜食近视1500度,嘉人女性影响力之夜,自卑型人格有多累,华为鸿蒙发布会,嘉人深V内卷,

2021-06-03,信小呆现状,医院为阳性高考生设置独立考场,杨幂刘诗诗唐嫣同框 梦回仙剑,张哲瀚李佳琦直播,冰岛是世界上唯一没有蚊子的国家,华为已捐赠鸿蒙最核心基础架构,鞠萍姐姐最近在做这个项目,田园脆鸡堡回归,周冬雨影后团忙内,狗主人回应寻狗送北京房产,宋宋璨道歉,广东新增15例本土确诊,男子抱小孩找妈妈被当人贩子,广州本土病例有4例接种过首针疫苗,全智贤 离婚,我国风云四号首颗业务星成功发射,广州气膜方舱实验室投入使用,水淹屁股了宾客仍淡定吃酒席,满舒克,男子开长霉的车细菌感染住进ICU,特斯拉车主被困车内险窒息,迪丽热巴生日微博评论,吴亦凡有几个女朋友,李冰冰 亲倪妮搂孙俪摸杨幂,粤康码,郑秀晶腹肌,美国宣布对6国征收报复性关税,摸鱼背单词的软件,李现晒游戏新皮肤,全球多国房价惊人上涨,热心市民范丞丞,张哲瀚晒喝水照,叛逆者定档,李逍遥皮肤,安家杰 换人,文淇 手背打招呼,德特里克堡和731部队的肮脏交易,华为称鸿蒙更能解决手机卡顿,人和人的差距能有多大,重庆遇难老师不是第1次救人,大数据杀熟最高可罚5000万元,老人晕倒狗狗狂叫邻居报警救人,余文乐患急性惊恐症,警方辟谣外籍染病人员带病逃脱,专四,76人淘汰奇才,野象群进入昆明,俄议会批准退出开放天空条约,广东新增5例本土无症状,广州疫情,

2021-06-03,信小呆现状,医院为阳性高考生设置独立考场,路人看到刘诗诗的反应,龚俊代言雪花马尔斯绿,不生孩子的人后来都怎么了,女子请保姆照顾孩子后退租消失,杉菜的妈妈太有远见了,冰岛是世界上唯一没有蚊子的国家,全民打苗苗行为图鉴,荔枝季广东酱油销量暴涨,今年高考天气,易建联要为中国男篮再拼一次,致命女人,杨幂刘诗诗唐嫣同框 梦回仙剑,欧阳娜娜大提琴独奏,德特里克堡和731部队的肮脏交易,女子消费十万买不了平台会员,孙俪摘苏叶和薄荷泡红茶,刘宇敷手膜上班,花好月又圆定档,警惕自称疫苗接种普查员的好友申请,吴亦凡有几个女朋友,沈月孙宁约会,全智贤方否认离婚传闻,余文乐患急性惊恐症,男子开长霉的车细菌感染住进ICU,满舒克,宋宋璨道歉,原来这就是轻奢啊,广州一社区直播核酸检测进度,李冰冰 亲倪妮搂孙俪摸杨幂,广东人说普通话能有多好笑,嘉人地产公司,东北人眼里的轻食,广东新增15例本土确诊,我国风云四号首颗业务星成功发射,华为已捐赠鸿蒙最核心基础架构,迪丽热巴生日微博评论,美国一州拟用纳粹毒气处决死囚,特斯拉回应车主被困车内险窒息,中共一大纪念馆开馆,密室大逃脱,广州核酸阳性高考生配备专门医护,独行侠战胜快船,陈漫 懂比爱更重要,东契奇42分,叛逆者定档,蔬菜价格下降,张文宏谈中国何时能打开国门,摸鱼背单词的软件,

2021-06-03,台女子持阳性证明登机抵厦门,新疆人讲述真实的新疆,路人看到刘诗诗的反应,和迪丽热巴一起冰爽进圈,原来这就是轻奢啊,从今以后只信CCTV厂牌的曾毅,救援队打捞出教师遗体站成一排默哀,信小呆现状,东北人眼里的轻食,杉菜的妈妈太有远见了,台湾新增583例本土确诊病例,会拜拜的小猫咪有多可爱,全国新冠疫苗接种剂次超7亿,江苏阿姨设计中国风高考锦鲤旗袍,陈漫 懂比爱更重要,女子请保姆照顾孩子后退租消失,戚薇把香蕉皮挂胸口,女子消费十万买不了平台会员,摩尔庄园渔网,温州市民自制奶茶感谢疫苗接种医务人员,暴雨致郑州上街区两人死亡,沈月孙宁约会,全智贤方否认离婚传闻,冰岛是世界上唯一没有蚊子的国家,密室大逃脱,为什么不直接使用麻醉枪限制野象继续北上,余文乐患急性惊恐症,刘宇敷手膜上班,水果的邪门吃法,2022年全球失业人数将达2.05亿,看别人社死能有多好笑,满舒克,孙俪摘苏叶和薄荷泡红茶,爱上特种兵,摩尔庄园菜谱,医院为阳性高考生设置独立考场,福岛核电站又一集装箱泄漏核污染水,杭州高考考点附近酒店房紧张,乐高积木是怎么做出来的,清华北大位列亚洲大学排名前二,德特里克堡和731部队的肮脏交易,你介意同事上班摸鱼吗,商务部 中美经贸领域已开始正常沟通,国务院安委办山西暗查,5岁男童在美墨边境绝望乞求走私犯留下,致命女人,女交警温柔喊话违规车主,全民打苗苗行为图鉴,辞职后工作群千万不要主动退,陕西健康码上线兵马俑皮肤,

2021-06-03,信小呆被多家公司抢注商标,台女子持阳性证明登机抵厦门,薇娅公司被行政处罚,理想生活狂欢季,辞职后工作群千万不要主动退,吸烟装,你介意同事上班摸鱼吗,从今以后只信CCTV厂牌的曾毅,鸿蒙全家桶,云南堵象人4天吃住卡车上,外交部称美国是公认全球头号窃密大户,广州又有2地实行封闭管理,原来这就是轻奢啊,清华北大位列亚洲大学排名前二,会拜拜的小猫咪有多可爱,全国新冠疫苗接种剂次超7亿,中餐厅5 嘉宾,杨洋迪丽热巴客厅路透,刘芸扮演邓稼先夫人倒模过程,王源 建议恐怖本程度加深,不教高年级的原因,李健 Marine不是某一个女人,岳岳 我更好了但机会更少了,当网名被叫出来有多尴尬,白敬亭逗NPC,特斯拉对车主被困车内致歉,主动放弃爱情的瞬间,戚薇把香蕉皮挂胸口,能写到简历里的技能,高中和大学体育课的区别,猫吹干前后的差距有多大,沈月孙宁约会,满舒克,新疆人讲述真实的新疆,刘宇对伯远撒娇,鲁迅是个脱口秀演员吧,摩尔庄园渔网,商务部 中美经贸领域已开始正常沟通,东北人眼里的轻食,蚂蚁消费金融公司获批准开业,路人看到刘诗诗的反应,2021高考举报电话开通,袁娅维演出后台摊煎饼,KPL,5岁男童在美墨边境绝望乞求走私犯留下,这就是未来的体育老师吗,陕西健康码上线兵马俑皮肤,高考诈骗受害者3年后诈骗高考生,信小呆现状,诈骗团伙3个月狂发4.6亿条短信骗钱,

