2021-08-25,警方通报钱枫被曝性侵案,东京残奥会开幕式,保护全红婵,佳洁士炫白宫略,人民网评钱枫被指性侵,为我复读一年的男朋友,我国成功发射融合试验卫星,钱枫商业版图,女子高烧三周不肯就医致多器官衰竭,宿舍窗帘有必要买吗,高明远利用麦佳,钱枫事件当事人公布部分监控视频,你可以一天不说话吗,孙一文镜头表现力,钱枫事件涉事饭店称警方曾去取证,人民日报评明星粉丝群被禁言,赵丽颖工作室被禁言,S11官宣从中国改为欧洲举办,日本造币局回应奥运金牌掉皮,商丘学生虐狗通报,均龄8岁少年团家长回应质疑,黄旭熙曾说什么时候能见到女友,黄希房子塌了,豆豆 和彭于晏一起坐飞机是什么体验,现在威在旦夕曝与黄旭熙聊天记录,难怪张艺兴嗑瓜子看着眼熟,汪峰定律,李诞因发布违法广告被罚87万,如果绿藤市有热搜,换个思路看最好的我们,警方回应莘县一小孩被狗撕咬,王建国怼宁静,李佳航新剧演备胎,高卿尘问烤冷面为什么是热的,塔利班称我们不是恐怖分子,脱口秀大会,日本拟于2030年前开放福岛核禁区,哈根达斯用代可可脂冒充巧克力被罚,张伯礼 本轮疫情拐点将出现,柳碧云要给李冰找后妈,教育部称让学生在劳动实践中出力流汗,云南保山惊现蛇纹巨型飞蛾,中国残奥会夺冠瞬间,妻子分娩去世丈夫欲取冷冻胚胎遭拒,脱离传销女孩拍视频披露受骗细节,成都均龄8岁男团训练基地已无人,下雨天千万别用塑料袋套鞋,工人日清150吨新冠医废双手被汗水泡烂,恰同学少年,22岁女子7万将儿子卖给医疗公司,

2021-08-25,警方通报钱枫被曝性侵案,女子高烧三周不肯就医致多器官衰竭,保护全红婵,人民网评钱枫被指性侵,为我复读一年的男朋友,日本造币局回应奥运金牌掉皮,钱枫商业版图,高明远利用麦佳,张伯礼 本轮疫情拐点将出现,教育部称让学生在劳动实践中出力流汗,钱枫事件涉事饭店称警方曾去取证,孙兴给贺芸过生日,宿舍窗帘有必要买吗,警方回应莘县一小孩被狗撕咬,商丘学生虐狗通报,钱枫事件当事人公布部分监控视频,赵丽颖工作室被禁言,你可以一天不说话吗,S11官宣从中国改为欧洲举办,东京残奥会开幕式,黄旭熙曾说什么时候能见到女友,黄希房子塌了,豆豆 和彭于晏一起坐飞机是什么体验,现在威在旦夕曝与黄旭熙聊天记录,难怪张艺兴嗑瓜子看着眼熟,汪峰定律,李诞因发布违法广告被罚87万,哈根达斯用代可可脂冒充巧克力被罚,日本拟于2030年前开放福岛核禁区,工人日清150吨新冠医废双手被汗水泡烂,王建国怼宁静,李佳航新剧演备胎,22岁女子7万将儿子卖给医疗公司,妻子分娩去世丈夫欲取冷冻胚胎遭拒,脱口秀大会,脱离传销女孩拍视频披露受骗细节,均龄8岁少年团家长回应质疑,如果绿藤市有热搜,塔利班称我们不是恐怖分子,我国成功发射融合试验卫星,成都均龄8岁男团训练基地已无人,杭州男子拍潮水被卷走,云南保山惊现蛇纹巨型飞蛾,下雨天千万别用塑料袋套鞋,孙一文镜头表现力,柳碧云要给李冰找后妈,恰同学少年,福岛核污水排放方式基本敲定,换个思路看最好的我们,中国残奥会夺冠瞬间,

2021-08-25,警方通报钱枫被曝性侵案,上海新增2例新冠确诊,滚石乐队鼓手去世,举报钱枫女子回应警方通报,宁静 我支持所有的男生化妆,男孩地铁荡秋千家长一旁鼓励,小艺希望坏人被惩罚 音频,过敏原可以有多离谱,孙兴给贺芸过生日,我国成功发射通信技术试验卫星七号,人民网评钱枫被指性侵,主播虚构被家暴女性人设诈骗700余万,为我复读一年的男朋友,钱枫事件涉事饭店称警方曾去取证,刘国梁说期待和航天员打乒乓,豆豆 和彭于晏一起坐飞机是什么体验,张家界拆除所有交通卡口,女子高烧三周不肯就医致多器官衰竭,高明远利用麦佳,宿舍窗帘有必要买吗,黄旭熙曾说什么时候能见到女友,黄希房子塌了,难怪张艺兴嗑瓜子看着眼熟,现在威在旦夕曝与黄旭熙聊天记录,时代少年团成团二周年,汪东城直播约利路修散步,赵丽颖工作室被禁言,张家界全域降为低风险,本届残奥中国运动员全是业余选手,教育部称让学生在劳动实践中出力流汗,熊猫少儿艺术团解散,李佳航新剧演备胎,我国通信技术试验卫星七号发射成功,汪峰定律,张桂梅说到女高来了啥也不怕,保护全红婵,你可以一天不说话吗,日本造币局回应奥运金牌掉皮,如果绿藤市有热搜,东京残奥会开幕式,S11官宣从中国改为欧洲举办,张伯礼 本轮疫情拐点将出现,孙一文镜头表现力,均龄8岁少年团家长回应质疑,哈根达斯用代可可脂冒充巧克力被罚,下雨天千万别用塑料袋套鞋,云南保山惊现蛇纹巨型飞蛾,22岁女子7万将儿子卖给医疗公司,换个思路看最好的我们,警方回应莘县一小孩被狗撕咬,

2021-08-25,文艺界批饭圈文化娘炮形象,舒畅发博祝刘亦菲生日快乐,阿里女员工案嫌犯张某被批捕,王一博的啵啵牛乳茶,举报钱枫女子回应警方通报,孙颖莎王曼昱全运会将参加4个项目,朱雪莹的金牌真的抠不出巧克力,小艺希望坏人被惩罚 音频,汪顺的金牌也掉皮了,开国大典当天历史性画面和珍贵档案,警方通报钱枫被曝性侵案,王建国 我是真没听清现场在讲啥,15岁中考生霸凌室友并篡改其志愿,乔二强被抓,过敏原可以有多离谱,超市阿姨灭蚊13年研究蚊虫作息表,妲己原来是河南妹纸,高圆圆简约拼色露肩长裙,豆豆 和彭于晏一起坐飞机是什么体验,拼多多2021年二季度财报,江苏新增1例本土确诊,黄希房子塌了,黄旭熙曾说什么时候能见到女友,检察机关通报阿里事件,王志飞演技,皇马1.6亿报价姆巴佩,大一新生怎么做自我介绍,时代少年团成团二周年,喜获编制猫咪被消防员说教到睡着,上海新增2例新冠确诊,我国成功发射通信技术试验卫星七号,难怪张艺兴嗑瓜子看着眼熟,东京奥运奖牌的质量有多差,现在威在旦夕曝与黄旭熙聊天记录,滚石乐队鼓手去世,北京校长老师交流轮岗规则发布,孙红雷王志飞隐忍式飙戏,舍我其谁定档,全运会乒乓球参赛名单公布,印度人过节互扔石头致头破血流,教育部称让学生在劳动实践中出力流汗,篡改室友志愿中考生不满16岁未行拘,钱枫事件涉事饭店称警方曾去取证,男孩地铁荡秋千家长一旁鼓励,主播虚构被家暴女性人设诈骗700余万,日媒称福岛核废水将排放至近海,人民网评钱枫被指性侵,央视揭代订酒店骗局,张桂梅说到女高来了啥也不怕,为我复读一年的男朋友,

2021-08-25,举报1名涉毒逃犯或奖100万,喜羊羊与灰太狼官方拟人图,东京奥组委回应奖牌掉皮,李沁法式氛围妆,举报钱枫女子回应警方通报,每天有1亿件包裹到农村,女孩家属回应环卫工救孩子时动作不当,郎朗问魏大勋你约我老婆干啥,小艺希望坏人被惩罚 音频,烧烤外卖按串收打包费,塔利班高层在喀布尔会见中国大使,杨舒予戴眼镜太帅了,阿塔要求职业女性近期必须待在家中,吴谢宇弑母案一审明日再次开庭,张钰琪回归大片,男生找另一半看重什么,朱婷没想到伤病恶化,阿里女员工案嫌犯张某被批捕,陈都灵古装素服造型,汪顺的金牌也掉皮了,杨洋不懂为何在不同年纪被反复爱上,吴磊是把洞洞鞋焊脚上了吗,文艺界批饭圈文化娘炮形象,周雨彤新剧开播,赵奕欢快速平腹法,别让偶像低龄化坑了孩子,东京残奥会日本国旗升错了,王嘉尔官宣熊猫团,郭采洁的笔记只有自己能看懂,张睿刘学义新剧演父子,阿尔及利亚宣布与摩洛哥断交,王小梅摘东京残奥中国队首枚奖牌,超市阿姨灭蚊13年研究蚊虫作息表,王源说我也让你亲一口,北京东城区义务教育干部教师将全轮岗,网购枣夹核桃发现活虫,如何看待伴侣强行找存在感,女子驾驶奥迪高速路上逆行2公里,自己的葬礼怎样有排面,残奥会,开国大典当天历史性画面和珍贵档案,朱雪莹的金牌真的抠不出巧克力,处女座看完会崩溃的视频,妲己原来是河南妹纸,在坦克上跳芭蕾有多硬核,INTO1水中荷尔蒙大片,孙红雷王志飞隐忍式飙戏,太空出差三个月想家了怎么办,与君歌,日本政府拟花钱买海鲜,

2021-08-25,朱婷没想到伤病恶化,台州一小区下水道发现无名女尸,王一博宣发博理智追星倡议,吴磊 红狗喊你上场啦,周杰伦 按赞数超过20万丢出几秒前奏,残奥会中国队首金,四六级将提供电子成绩报告单,考上复旦女孩高中资料堆8米书山,举报钱枫女子回应警方通报,小米放弃MI品牌,喜羊羊与灰太狼官方拟人图,黄旭熙日程全面取消,李雪琴说你们可以喜欢我但不要学习我,退伍大学生制止偷盗脸被划14厘米伤口,全家承认上海部分门店售卖超期烤肠,电梯冲顶致死业主家属索赔120万遭拒,欧阳娜娜初秋穿搭,饭店厕所开门是一片玉米地,大叔酒吧门口猥亵醉酒女生,塔利班发言人涉华最新表态,张雨霏结束隔离回学校,威神V回应黄旭熙私生活争议,东京残奥会日本国旗升错了,Sunnee在美食节目中没吃上饭,原来超市价格标签是电子屏,郭采洁的笔记只有自己能看懂,工信部组织下架67款APP,撕咬小孩肇事犬主人被采取措施,库里父母宣布离婚,赵奕欢快速平腹法,北京SKP回应被投诉卖假货,中方奉行不干涉阿富汗内政政策,四川这个地方下雪了,原来口腔科不拔鱼刺,SM回应黄旭熙事件,杨舒予戴眼镜太帅了,塔利班称战士尚未学会和女性打交道,男子马路上强行按倒女子猥亵,被钱塘江潮水卷走男子确认身亡,喀布尔机场一瓶水卖260元人民币,和妈妈聊天聊哭了,自己的葬礼怎样有排面,塔利班高层在喀布尔会见中国大使,残奥会,章贺郭柯宇太甜了,举报1名涉毒逃犯或奖100万,用打麻将的干劲去工作,全球最大乐高乐园落户深圳,张钰琪回归大片,天目危机开播,

2021-08-25,赵丽颖呼吁更多关注生活的美好,台州一小区下水道发现无名女尸,当街强奸未遂男子已被抓获,佳洁士炫白宫略,严微入狱,全家承认上海部分门店售卖超期烤肠,周杰伦 按赞数超过20万丢出几秒前奏,限时抢美食福袋,江苏明确课后服务收费为每学期300元,残奥会中国队首金,超2500万中国网民联署要求调查美德堡基地,刘耀文live生图,李雪琴说你们可以喜欢我但不要学习我,李承铉模仿白展堂刘星表情包,一不小心当了言情小说女主,消防员拍婚纱照遭战友加压,老保安去世居民接力照顾孙子5年,黄旭熙日程全面取消,深圳机场的星巴克,残奥会中国队一天夺5金,晚霞,公厕趴地偷窥女性嫌疑人落网,SM回应黄旭熙事件,迪丽热巴十岁跳舞视频,苗侨伟60岁状态,现在威在旦夕再晒与黄旭熙聊天记录,白鹿说周生如故是绝世大甜剧,张新成连发7条经典台词庆生,原来口腔科不拔鱼刺,中国游泳队残奥会首金,警方回应男子强行按倒猥亵女子,阿富汗女足已乘机离开喀布尔,威神V回应黄旭熙私生活争议,许凯打羽毛球发球姿势,林少春怼桃夭太爽了,李佳航 我没整容,塔利班发言人涉华最新表态,语文老师的评语有多毒辣,周生如故全员神助攻,黄河壶口瀑布由浊变清,大叔酒吧门口猥亵醉酒女生,辰时cp细节好磕,小米放弃MI品牌,广州中银大厦撞脸乌鸦人,河南一副镇长因过度劳累不幸牺牲,饭店厕所开门是一片玉米地,男子马路上强行按倒女子猥亵,姑娘用3D立体书还原觉醒年代场景,考上复旦女孩高中资料堆8米书山,四川这个地方下雪了,

