2021-06-05,张子枫手机壳放着与欧阳娜娜的合照,国台办回应台湾核酸阳性居民飞抵厦门,顶楼,醒醒618车都开走了,黄子韬 我又不暗恋杨紫,黄磊对彭昱畅灵魂拷问,台湾赴美航班爆满,警方通报1岁幼童被父亲掐脖殴打,张文宏判断新冠疫苗需何时再次接种,咖啡和茶大涨价,野象群今日向西南迁移,杨紫 100斤是我最瘦的时候,胡歌看薛佳凝赵氏孤儿音乐剧,张若昀 带不动,张艺兴叫李雪琴姐,广州实施更大规模核酸检测,洛根李真的死了,胡歌回应十年没拍仙侠玄幻剧,王楚然经纪人,建议不要沉迷摩尔庄园太久,院士称中国脑机接口技术5年赶上马斯克,第一批90后开始收破烂了,刘姝贤 摩尔庄园,李沁最重的时候92斤,徐璐迪士尼生图,少年遭遇车祸致残重回课堂冲刺,双向暗恋错过是什么感受,向往的生活,云南蒙自璀璨星空,凉拌泡面的神仙吃法,外交部批美滥用国家力量打压中国企业,怀孕后身体会发生哪些变化,蔡徐坤指压板跳远跳了8米7,萌探探探案,想给梁森买防窥膜,我国拟立法禁止暴力伤医,李易峰ins更新,拒绝酒桌文化被教育了,逆天奇案,一公司女员工生三胎奖励10万元,TVB艺人的眼技有多绝,80后夫妻辞职卖房带娃航海旅行,摩尔庄园,奔跑吧,在校生该不该用生活费买基金,赵孝谦谢小满终于圆房,这就是人间芭比吧,高考前的最后一个晚自习,海关截获2只活体箱龟之王,高三女生为全班48人画漫画头像,

2021-06-05,张子枫手机壳放着与欧阳娜娜的合照,国台办回应台湾核酸阳性居民飞抵厦门,台湾赴美航班爆满,618星惊喜来了,黄子韬 我又不暗恋杨紫,黄磊对彭昱畅灵魂拷问,张文宏判断新冠疫苗需何时再次接种,顶楼,警方通报1岁幼童被父亲掐脖殴打,咖啡和茶大涨价,80后夫妻辞职卖房带娃航海旅行,胡歌看薛佳凝赵氏孤儿音乐剧,张若昀 带不动,张艺兴叫李雪琴姐,少年遭遇车祸致残重回课堂冲刺,广州实施更大规模核酸检测,胡歌回应十年没拍仙侠玄幻剧,王楚然经纪人,洛根李真的死了,第一批90后开始收破烂了,院士称中国脑机接口技术5年赶上马斯克,杨紫 100斤是我最瘦的时候,建议不要沉迷摩尔庄园太久,李沁最重的时候92斤,双向暗恋错过是什么感受,野象群今日向西南迁移,怀孕后身体会发生哪些变化,刘姝贤 摩尔庄园,云南蒙自璀璨星空,这就是人间芭比吧,外交部批美滥用国家力量打压中国企业,徐璐迪士尼生图,一公司女员工生三胎奖励10万元,向往的生活,拒绝酒桌文化被教育了,我国拟立法禁止暴力伤医,蔡徐坤指压板跳远跳了8米7,想给梁森买防窥膜,赵孝谦谢小满终于圆房,在校生该不该用生活费买基金,李易峰ins更新,TVB艺人的眼技有多绝,萌探探探案,逆天奇案,海姆立克急救法有多重要,海关截获2只活体箱龟之王,摩尔庄园,凉拌泡面的神仙吃法,高三女生为全班48人画漫画头像,奔跑吧,

2021-06-05,夏之光钟丽丽逛街,科兴疫苗紧急使用年龄扩大到3岁以上,安徽取消未满16周岁主播账号,王棠云回应余文乐夜店搂美女,业主群里的吵架有多好笑,北大教授谈大神韦东奕,高考倒计时100天种的向日葵开花了,遭追求者砍杀女硕士家属发声,张子枫手机壳放着与欧阳娜娜的合照,广东新增11例本土确诊病例,张艺兴的编曲软件是刘宪华装的,上海将发放35万份数字人民币红包,华为发布鸿蒙系统沟通口径通知,野象群如不南返会有什么后果,湖北潜江4人核酸检测弱阳性,被导师私信要求换头像,摩尔庄园偷牛,淘票票崩了,女孩自信起来有多美,黄子韬 我又不暗恋杨紫,印度已超2万人感染毛霉菌病,觉醒年代壁纸,芒种,张若昀 带不动,世界环境日,第一批90后开始收破烂了,象群进村民家拧开水龙头喝水,杭州高层楼顶成网红打卡地,洛根李真的死了,向往的生活预告,东京奥运会闭幕宴会已决定取消,王楚然经纪人,胡歌回应十年没拍仙侠玄幻剧,广州这组照片值得刷屏,普京称不期待与拜登会晤有任何突破,李沁最重的时候92斤,石家庄86岁旗袍奶奶,张艺兴叫李雪琴姐,双向暗恋错过是什么感受,药学专业学生自制驱蚊香囊送师生,觉醒年代,原来科目二这么难考,31省区市新增24例确诊,杨紫 100斤是我最瘦的时候,黄磊对彭昱畅灵魂拷问,NBA季后赛,广州疫情防控新闻发布会,建议不要沉迷摩尔庄园太久,台湾赴美航班爆满,新疆四只赤狐放归自然,

2021-06-05,大S 汪小菲,考古研究院学生掉入考古坑致骨折,信小呆不想再被打扰,江湖悠悠,李沁 黄景瑜健身工具人,气球被吹飞女儿瞬间抱住妈妈,女孩自信起来有多美,易烊千玺童年照,在公交车上碰到了一个有趣的陌生人,科兴疫苗紧急使用年龄扩大到3岁以上,北大教授谈大神韦东奕,夏之光钟丽丽逛街,世界环境日,广州无症状感染考生将在病房参加高考,顶楼3是喜剧吗,猫咪抓到鼹鼠送给主人,被导师私信要求换头像,保罗更衣室激情演讲,原来科目二这么难考,云南悬崖采蜜人不足100人,鲸与少年,王棠云回应余文乐夜店搂美女,张艺兴的编曲软件是刘宪华装的,广州本轮疫情暂未发现物传人现象,白敬亭演肖鹤云,摩尔庄园偷牛,河南一煤矿发生煤与瓦斯突出事故,南非大象突然冲向卡车吓懵司机,芒种,业主群里的吵架有多好笑,遭追求者砍杀女硕士家属发声,未成年人什么时候可以打疫苗,安徽取消未满16周岁主播账号,觉醒年代壁纸,你是刚从河里被捞起来的吗,高考倒计时100天种的向日葵开花了,教育部发布高考防骗预警,高中时代做过最暧昧的事,中国男篮集训队首次人员调整,普京称不期待与拜登会晤有任何突破,如梦之梦抢票,伦纳德关键三分,快船独行侠抢七,NBA,伦纳德45分,摩尔庄园河童,摩尔庄园下雨,叙利亚领先国足8分,顶楼变成机智的监狱生活,象群进村民家拧开水龙头喝水,

2021-06-05,林心如硕士毕业,夫妻伪造白血病病例来消费村民爱心,咸阳11岁失踪男孩已遇害,新一代女神爱的宣言MV,韩国设计师为低头族发明第三只眼,摩尔庄园下雨,被导师私信要求换头像,奔跑吧超能时刻,广州南沙公交地铁停运,父亲用养老金替老赖女儿还债,恰好是少年复播,气球被吹飞女儿瞬间抱住妈妈,巴西小城接种中国疫苗后死亡率降95%,重庆朝天门两江交汇现鸳鸯锅奇观,牺牲英雄的母亲说我们都是爱生如子,救陶勇的五双手,李沁 黄景瑜健身工具人,偷外卖的狗子被通缉了,张子枫毕业视频同学录,李易峰Jalouse法国版封面,全部离南沙通道暂时关闭,世界环境日,汪小菲回应,妈妈称大S说的是气话,小朋友说粤语有多可爱,广州高风险区和封闭区设4个高考考点,考古研究院学生掉入考古坑致骨折,公司要求带妆上班你会跑吗,大S 汪小菲,不是所有的布偶猫都温顺,信小呆不想再被打扰,女孩自信起来有多美,摩尔庄园蘑菇,农村大妈抱自家蔬菜走秀,原来科目二这么难考,饭店投毒损毁行道树6人被刑拘,第一次戴美瞳有多难,顶楼,摩尔庄园河童,老师自制105支口红送毕业生,致命女人,白敬亭演肖鹤云,张子枫棒球服造型,易烊千玺童年照,爱上特种兵,绿色答卷,INTO1快乐大本营饭拍,如梦之梦抢票,缅甸琥珀中首次发现虾类化石,芒种,

2021-06-05,汪小菲的编辑记录逐渐收敛,中国人首次拿到三阶魔方平均世界纪录,长沙起火,赵丽颖去拔罐了吗,因五万彩礼被男友骂虚荣,中国美院学生手握一杯土10天后长草,毛坦厂送考头车车牌91666,赵今麦演李诗情,摩尔庄园下雨,广州南沙公交地铁停运,上海南京苏州等8城试点异地提取公积金,林心如硕士毕业,全部离南沙通道暂时关闭,司机赤脚醉驾自称女娲后人,绿色答卷,王一博生图,狗狗的证件照能有多正经,黄奕把剧本当枕头,第二眼依然以为是影子,女孩子间的友谊太美好了,大S向柴智屏表明离婚意向,汪小菲回应,周柯宇侧颜,赵丽颖拜冰玩趣蛋纸海报,近视的儿童有治愈可能吗,妈妈称大S说的是气话,咸阳11岁失踪男孩已遇害,偷外卖的狗子被通缉了,CUBA,韩国设计师为低头族发明第三只眼,大S 汪小菲,吴倩蓝色意境胶片照,台湾新增511例本土确诊病例,被导师私信要求换头像,夫妻伪造白血病病例来消费村民爱心,街舞社的齐舞作品 家暴主题,我为什么选择了摸鱼,张子枫毕业视频同学录,阳光姐妹淘终极预告,牺牲英雄的母亲说我们都是爱生如子,9张高清壁纸送给2021高考考生,考前一天我们能做些什么,男子手绘1977年高考准考证,安庆人民路,云南大象迁徙直接受害者,高校运动会跑得最快的是摄像,巴西小城接种中国疫苗后死亡率降95%,70岁教师放弃高薪返聘去大山支教,恰好是少年复播,救陶勇的五双手,

2021-06-05,南沙疫情,广州全市11区已启动全员核酸检测,罗一舟捧花出席活动,警方通报安庆男子当街行凶,外国网友点赞中国新疆民警,觉醒年代 巴黎和会,刘雨昕苏菲推荐List,长沙起火,摩尔庄园迷惑行为,学子高考前撕书减压纸张漫天飞,广州南沙公交地铁停运,快乐大本营,赵丽颖去拔罐了吗,杭州没有西溪湿地会怎样,北大淘汰矿大晋级全国四强,91岁爷爷玩滑翔伞喜笑颜开,王子奇发文告别御赐小仵作,郑恺 青岛,因为不陪客户喝酒被开除了,蔡徐坤 个人巡回演唱会,摩尔庄园鲨鱼,汪小菲的编辑记录逐渐收敛,大S向柴智屏表明离婚意向,中国美院学生手握一杯土10天后长草,Wonderland仙境之夜,牧民说只要活着就不会停止保护藏羚羊,王一博生图,大S 汪小菲,狗狗的证件照能有多正经,摩尔庄园的bug好好笑,全部离南沙通道暂时关闭,陈飞宇抱罗云熙路透,比特币走势,猫咪幼崽能有多可爱,蚊子是怎么被馋死的,绿色答卷,汪小菲回应,北京彩虹,饭局上领导夸你如何回复,雪碧荔枝冻冻冰,给公司提建议被批评了,广东多地对口支援广州核酸检测,名字很大众化是什么体验,涉运毒案17岁女生取保参加高考,北京晚霞,被拐走6年女儿终于回家,腾讯会议崩了,近视的儿童有治愈可能吗,中国疫苗开发路线背后的无名英雄,张九龄报NBA队名,

2021-06-05,iPhone13或有黄铜色,涉运毒案17岁女生取保参加高考,黄晓明状态,Reno6系列今日开售,程潇身材,科兴 接种第三针疫苗后抗体可提升十倍,周也性格,专家提醒超50岁至少做1次内镜检查,父亲关投资百万工厂陪读儿子,南沙疫情,绿色答卷,快乐大本营,广州6月6日起暂停实施开四停四,INTO1快本舞台,广东中高风险区停售感冒灵等药品,被拐走6年女儿终于回家,孟佳 生图姐自己发,吴磊张子枫为高考加油,李子柒流觞曲水桌,女生结婚该不该要彩礼,江西专升本,汪小菲的编辑记录逐渐收敛,大S向柴智屏表明离婚意向,当儿子突然爱上奥特曼,魏大勋把粉笑喷到刘耀文碗里,杭州没有西溪湿地会怎样,多米尼加总统打中国疫苗称没夫人掐得疼,郑合惠子随性街拍,Wonderland仙境之夜,腾讯会议崩了,广州南沙公交地铁停运,见过最离谱的公司晨会,五十公里桃花坞,赵丽颖去拔罐了吗,罗一舟捧花出席活动,全部离南沙通道暂时关闭,精神内耗严重的表现,安庆紧急招募无偿献血者,被理科生浪漫到了,在摩尔庄园不穿衣服被抓了,学中文有多让人头疼,致命女人2,爱上特种兵,赢在了起跑线上的发量,00后侦察兵挑战海上5000米蛙泳,郭麒麟是穿了弟弟的睡衣吗,郑恺 青岛,65岁大爷下河救起71岁老人,广州全市11区已启动全员核酸检测,9年拍3000张照片记录北京空气质量,

