2021-08-11,雷军删掉所有炒股软件,阿里女员工醉酒饭店店员发声,原来我很爱你,苏炳添旅游计划被内蒙古文旅厅接收到了,长沙两位新冠肺炎康复者成功捐献血浆,陈露谈与霍尊九年恋情,吴亦凡 洛杉矶女粉丝,Hero放出当天比赛语音,福原爱说这是第一次认真观看奥运,美国抗疫八个全球第一,全红婵选拔赛前3周才学完跳水动作,梅西加盟巴黎圣日耳曼,小米向首批用户赠送1999元红包,男子冒充被救女孩哥哥直播,秦皇岛获救三女子追悼会跪谢,人类高质量学长周斯越,杨子说黄圣依马后炮,于途恋爱后的虎狼之词,确诊新冠老人用药盒写情书给老伴,店员称阿里事件七八人喝了四五瓶白酒,孙兴的原型是孙小果吧,庞博吐槽奶茶像兑水粽子,徐妈称大S汪小菲已和好,为什么乒乓球队还不发隔离日记,苏念衾求婚,张艺兴lucky式抓捕,我在他乡挺好的结局,于途见家长社死现场,7处场所是被偷拍高危区域,中方召回驻立陶宛大使,孙红雷让江疏影找张艺兴要电话,王昭君七夕节皮肤,小米平板5价格,尼格买提用胶带给撒贝宁封口,杨洋 于途能有什么坏心思呢,恒大考虑出售恒大汽车,许昕直播太好笑了,迪丽热巴微表情大师,阿里女员工涉事酒店为亚朵轻居,你是我的荣耀,脱口秀大会4首播快乐地狱,小米发布会,能嫁给樊振东的办法,东京奥运会总支出超200亿美元,雷军和苏炳添长得有点像,于途肖奈都是宜兴人,杜淳说因为离家太久蛋饺已经不认识自己,吴月红孙世杰婚姻危机,医生解读如何科学减肥,脱口秀大会,

2021-08-11,雷军删掉所有炒股软件,阿里女员工醉酒饭店店员发声,Hero放出当天比赛语音,苏炳添旅游计划被内蒙古文旅厅接收到了,原来我很爱你,陈露谈与霍尊九年恋情,和TA一起搭鹊桥,吴亦凡 洛杉矶女粉丝,小米向首批用户赠送1999元红包,全红婵选拔赛前3周才学完跳水动作,美国抗疫八个全球第一,福原爱说这是第一次认真观看奥运,确诊新冠老人用药盒写情书给老伴,为什么乒乓球队还不发隔离日记,秦皇岛获救三女子追悼会跪谢,店员称阿里事件七八人喝了四五瓶白酒,于途恋爱后的虎狼之词,杨子说黄圣依马后炮,孙红雷让江疏影找张艺兴要电话,长沙两位新冠肺炎康复者成功捐献血浆,男子冒充被救女孩哥哥直播,孙兴的原型是孙小果吧,徐妈称大S汪小菲已和好,张艺兴lucky式抓捕,人类高质量学长周斯越,于途见家长社死现场,我在他乡挺好的结局,恒大考虑出售恒大汽车,庞博吐槽奶茶像兑水粽子,阿里女员工涉事酒店为亚朵轻居,中方召回驻立陶宛大使,东京奥运会总支出超200亿美元,小米平板5价格,杜淳说因为离家太久蛋饺已经不认识自己,苏念衾求婚,尼格买提用胶带给撒贝宁封口,梅西加盟巴黎圣日耳曼,王昭君七夕节皮肤,迪丽热巴微表情大师,7处场所是被偷拍高危区域,于途肖奈都是宜兴人,医生解读如何科学减肥,柳碧云被江梅刁难,杨洋 于途能有什么坏心思呢,能嫁给樊振东的办法,许昕直播太好笑了,吴月红孙世杰婚姻危机,雷军和苏炳添长得有点像,扫黑风暴,脱口秀大会,

2021-08-11,陈露好友王萌发文,孙颖莎说世界排名说明不了什么,杭州一药店因向发烧人员出售退烧药被查,针孔摄像头可让百人在线观看,顾漫的骄阳似我什么时候写完,霍尊爸爸回应,出发吧旅行团,几乎所有美国人都处于新冠病毒高传播地区,梅西年薪为3500万欧元,Hero放出当天比赛语音,田汨 抛弃糟糠之妻,你算什么男人,papi酱 好阿姨比男朋友难找,吴亦凡 洛杉矶女粉丝,纽约州州长科莫宣布辞职,北京新增京外关联本地确诊1例,陈露谈与霍尊九年恋情,15岁女孩喝13瓶啤酒后飙车撞杆,于途恋爱后的虎狼之词,奥运健儿隔离时有多自律,亚朵集团回应阿里员工被侵害事件,孙兴的原型是孙小果吧,苏炳添旅游计划被内蒙古文旅厅接收到了,杨子说黄圣依马后炮,小米向首批用户赠送1999元红包,于途对乔晶晶说我会很主动,孙红雷让江疏影找张艺兴要电话,我在他乡挺好的结局,于途见家长社死现场,全国中高风险地区一览,于途乔晶晶见家长时互飙演技,张艺兴lucky式抓捕,于途打通恋爱的任督二脉,秦皇岛获救三女子追悼会跪谢,庞博吐槽奶茶像兑水粽子,广州暴雨,雷军删掉所有炒股软件,全红婵选拔赛前3周才学完跳水动作,为什么乒乓球队还不发隔离日记,浙江严查快递未经同意放代收点,中方召回驻立陶宛大使,扬州新增54例本土确诊,闫妮演的柳碧云,北京新增7例境外输入无症状,许言的结局,原来我很爱你,福原爱说这是第一次认真观看奥运,当防疫人员无聊时,施罗德加盟凯尔特人,人类高质量学长周斯越,

2021-08-11,腾讯实习生建议高管颁布拒绝陪酒条令,孙颖莎说世界排名说明不了什么,警方通报女孩跪地被扇耳光,papi酱 好阿姨比男朋友难找,针孔摄像头可让百人在线观看,你算什么男人,周也马闻远好久不见,宁波舟山港发现1例新冠阳性,吴亦凡 洛杉矶女粉丝,陈露好友王萌发文,起底南京禄口机场保洁公司,霍尊爸爸回应,张瑛,田汨 抛弃糟糠之妻,顾漫的骄阳似我什么时候写完,杭州一药店因向发烧人员出售退烧药被查,万茜李庚希痛哭,几乎所有美国人都处于新冠病毒高传播地区,15岁女孩喝13瓶啤酒后飙车撞杆,美国一女子超市舔商品自证不怕新冠,5900元可租日本奥运足球场馆办婚礼,陈露谈与霍尊九年恋情,贾乃亮黄明昊作弊猜词,500万人内的全员核酸要2天内完成,许言的结局,雷军曝曾被投资人训了一个小时,孟晚舟案司法补救审理结束,谁是美国零号病人,无限深度改名峰爆定档,奥运健儿隔离时有多自律,白俄罗斯总统对着BBC痛骂英国,扬州新增54例本土确诊,童瑶心形花卉裙,孙兴的原型是孙小果吧,唐九洲发文庆出道三周年,梅西身披30号球衣在球场颠球,于途对乔晶晶说我会很主动,于途恋爱后的虎狼之词,纽约州州长科莫宣布辞职,亚朵集团回应阿里员工被侵害事件,扬州一小区业主纷纷加入感恩献爱心行列,空军二级战斗英雄焦景文逝世,iPhone13将为专业用户定制新相机功能,梅西年薪为3500万欧元,浙江严查快递未经同意放代收点,酒桌的套路有多深,长大后那些童年报复性补偿,库里夸梅西选30号有品位,梅西和巴黎签约到2023年,我在他乡挺好的结局,

2021-08-11,加拿大籍被告人被判刑11年驱逐出境,于月仙车祸地时有发生交通事故,赵奕欢考到航空运动飞行驾驶员执照,曾毅坐轮椅,游客减少导致企鹅出现心理问题,马思唯 尚气,iPhone13将为专业用户定制新相机功能,许昕说世界冠军喊自己也跟着喊,日本现首例拉姆达毒株感染病例,白俄罗斯总统对着BBC痛骂英国,郭子凡 不坚持了随便吧,王一博swag挑眉杀,这就是街舞,腾讯实习生建议高管颁布拒绝陪酒条令,刷酸美容需在医疗机构开展,江苏老太聚集打牌吐口水,杨幂晒手绘图,女孩在宠物店用玻璃门夹死小猫,心疼吴月红,我的姐姐韩国上映,霍尊风波后首现身,田汨 抛弃糟糠之妻,杨洋 拍荣耀记忆力锻炼得特别好,陈露好友王萌发文,马云回应雷军被张瑛数落谣言,霍尊爸爸回应,老友记,披荆斩棘的哥哥,深圳女子网上买猴被骗4千多,各省双减工作落实进度将每半月通报一次,武汉军运会期间美国四大反常举动,长相思,现实版朱迪,女子拍闪电拍到闪电劈向自己,Blackpink运动大片,国乒国羽梦幻联动,如何看待陈露曝光与霍尊的恋情,出于礼貌吃过最难吃的食物,玫瑰行者开播,孙颖莎说世界排名说明不了什么,国务院发文明确双减半月通报制度,林sir直男行为大赏,全红婵想开一家大超市,陈哲远校服杀,生孩子会影响夫妻感情吗,德国一护士用生理盐水冒充新冠疫苗,李鸣岩去世,网传江苏武警全面接管扬州等消息不实,恋与制作人,针孔摄像头可让百人在线观看,

2021-08-11,警方通报女子被丈夫剃光头拍照发网上,亚朵称阿里女员工确认后开房卡,李鸣岩去世,一元公益日,霍尊手写信回应,王萌 既然锤了就锤到底,倪萍 我活到60岁第一次听到这个观点,和TA一起搭鹊桥,女子拍闪电拍到闪电劈向自己,警方未认可亚朵酒店声明,全红婵想开一家大超市,国务院发文明确双减半月通报制度,曾毅坐轮椅,孙芮乃万粉丝和平公约,于月仙车祸地时有发生交通事故,西班牙发现6万年前壁画,拥有明星脸是什么体验,迪丽热巴瑞丽26周年封面,北京疫情,B站UP主谎称患癌骗捐,中国乒乓球队强大背后的科技力量,生孩子会影响夫妻感情吗,如何看待陈露曝光与霍尊的恋情,郭子凡 不坚持了随便吧,辣目洋子看孙世杰出轨气笑了,杨紫黄子韬xxj吵架,周雨彤拒绝自我牺牲式爱情,霍尊风波后首现身,亚朵,女孩在宠物店用玻璃门夹死小猫,男子出狱后醉驾返回看守所看狱友,各省双减工作落实进度将每半月通报一次,阚清子剧本杀天赋型选手,赵丽颖黄晓明录视频为消防员点赞,白敬亭说我要对得起这份机遇,出于礼貌吃过最难吃的食物,扬州和郑州正在发展为疫情新中心,扫黑风暴是演技风暴吧,加拿大籍被告人被判刑11年驱逐出境,江苏老太聚集打牌吐口水,浆小白豆浆捞出数只黑虫后再卖,白俄罗斯总统对着BBC痛骂英国,刘国梁机场化身孙颖莎保镖,北京高校师生最新返京规定,全红婵想去水上乐园,这就是街舞,梅西正式加盟巴黎圣日尔曼,扬州第5轮核酸共检出25例阳性,白发老太不戴口罩聚集打牌称不怕坐牢,杭州暴雨,

2021-08-11,倪萍 我活到60岁第一次听到这个观点,警方通报女子被丈夫剃光头拍照发网上,郭晶晶晒孩子跳水画面,令人心动的承诺,龚俊 单纯分享歌曲切勿乱解读哦,人贩子梅姨仍未找到,立陶宛首都爆发抗议活动,鲍珊菊连麦聊夺冠时刻,刘国梁机场化身孙颖莎保镖,你是我的荣耀,福建爷爷带11个孙辈乡村过暑假,外交部回应中方召回驻立陶宛大使,白敬亭把老婆孩子纳入人生规划,回应了但又没完全回应,霍英东舍命运物资支援抗美援朝,亚朵称阿里女员工确认后开房卡,女子拍闪电拍到闪电劈向自己,奚梦瑶给何猷君备注一家之猪,王一博被警报声吓一哆嗦,3米长大蟒蛇一口气吞掉16只鸡,北京疫情,拥有明星脸是什么体验,杨洋迪丽热巴互发童年比耶照,霍尊手写信回应,王萌 既然锤了就锤到底,茂名被袭击交警已牺牲,辣目洋子看孙世杰出轨气笑了,人类高质量倒霉蛋,陈露发一串省略号,LPL,广东一交警执勤时被人砍倒,国务院发文明确双减半月通报制度,北京昌平某确诊病例密接1751人,国内第一例脑机接口手术,经济学家不建议上班族炒股,我国冬奥会训练使用风洞,罗一舟受伤,时代少年团朱雀应援法,扫黑风暴,遇到茶艺大师怎么办,张哲瀚的镜头碎片,各省双减工作落实进度将每半月通报一次,原来我很爱你,巴黎主席称梅西加盟是历史时刻,心动的信号4,跟着运动员在家健身,时代少年团我喜欢你应援法,宠物墓地价格逼近京郊房价,青岛海关查获42吨腐烂生牛皮,警方未认可亚朵酒店声明,

2021-08-11,货拉拉跳车死亡案涉事双方发声,撒贝宁称苏炳添yyss,于途乔晶晶教科书式异地恋,令人心动的承诺,龚俊 单纯分享歌曲切勿乱解读哦,郭晶晶晒孩子跳水画面,东奥组委会为浪费13万份食物道歉,鲍珊菊连麦聊夺冠时刻,人贩子梅姨仍未找到,苏炳添在奥运闭幕式上手机都没敢带,国务院 若发生疫情定点医院48小时内腾空,外交部回应中方召回驻立陶宛大使,朱婷报案网民造谣诽谤,青岛流亭机场的最后一夜,福原爱谈这届东京奥运会的意义,南京禄口街道3名干部因防疫不力被查,四川疫苗接种土味广告,angelababy 在感情中不要丢失自我,郭麒麟 爱不需要轰轰烈烈,胡海泉被工作人员叫胖宝,奚梦瑶给何猷君备注一家之猪,小车高速上爆胎翻滚解体致3死,白敬亭给女篮李梦送鞋,霍尊手写信回应,杨洋迪丽热巴互发童年比耶照,王萌 既然锤了就锤到底,哥哥全员披荆斩棘,跳水梦之队隔离vlog,陈露发一串省略号,北京昌平某确诊病例密接1751人,3米长大蟒蛇一口气吞掉16只鸡,国务院发文明确双减半月通报制度,王建国张博洋淘汰,8分钟简单在家瘦腰运动,扫黑风暴,我说晚安等于社会性睡眠,心动的信号4,最令人窒息的网课社死现场,莫寒被泄露防疫信息,希林娜依高在线催婚荣耀夫妇,东京奥运会火炬手曾参与汶川地震救灾,各省双减工作落实进度将每半月通报一次,杨蒙恩 陪女友逛街像做情感测试,历史上谁最像穿越者,苏宁董事长履职后首次发全员信,英仙座流星雨来了,球迷排长队买梅西球衣,4名女子偷月季当玫瑰卖被刑拘,主人用塑料瓶固定狗头帮剪指甲,茂名被袭击交警已牺牲,

