2021-07-31,马龙夺乒乓球男单金牌,伊藤美诚教练称孙颖莎不按套路打球,马龙成首位奥运男单双冠王,外油内干有救了,孙红雷劝小演员把学上完,中国女篮挺进奥运8强,马龙的保温杯vs樊振东的冰水,刘国梁 男单金牌是两个人共同拿下的,奥运史上最心酸的一块金牌,姚安娜有点憨,成都封控小区为1岁宝宝庆生,林生斌被曝家暴出轨,李月汝罚球绝杀,马龙打破国乒球员参与奥运年龄纪录,马龙出发奥运会前打了封闭,樊振东夺乒乓球男单银牌,王靖雯上好声音了,全剧唯一认真反派李美娥,余生请多指教,丁真 我是四川的,周也中餐厅的第一顿晚餐,林生斌前岳父母首发声,张艺兴 中国队yyds,塔克拉玛干沙漠发洪水,国乒三剑客永远的神,奥恰洛夫哭了,龚俊吃饭好香,杭州一地发现密接人员1例,南京辟谣全国暂停寄往江宁快递,马龙樊振东升国旗奏国歌,抗洪救援队返程被收千元过路费,家庭条件对孩子成才的影响有多大,中餐厅,吴京看到易烊千玺造型的反应,薇娅谢霆锋直播,严浩翔退出少年说唱企划,马龙采访,女儿1个多月未见抗洪爸爸被吓哭,李荣浩周杰伦合唱默,用最狠的态度说最卑微的话,游客离开张家界须完成三次核酸检测,刘国梁马琳轻松观战,马龙3届奥运传奇回顾,中国好声音,西安大雁塔北广场喷泉表演暂停,那英李健合唱等你下课,兵马俑景区附近现多辆急救车,阚清子倪虹洁催泪告别,好声音都十年了,杨舒予直播,

2021-07-31,伊藤美诚教练称孙颖莎不按套路打球,马龙夺乒乓球男单金牌,雨衣爸爸称后悔没教女儿学游泳,皮卡丘花木兰ID失踪了,刘国梁 男单金牌是两个人共同拿下的,马龙成首位奥运男单双冠王,马龙的保温杯vs樊振东的冰水,孙红雷劝小演员把学上完,宁静笑死我了,中国女篮挺进奥运8强,成都封控小区为1岁宝宝庆生,林生斌被曝家暴出轨,姚安娜有点憨,马龙打破国乒球员参与奥运年龄纪录,奥运史上最心酸的一块金牌,塔克拉玛干沙漠发洪水,王靖雯上好声音了,余生请多指教,全剧唯一认真反派李美娥,丁真 我是四川的,南京辟谣全国暂停寄往江宁快递,林生斌前岳父母首发声,杭州一地发现密接人员1例,马龙出发奥运会前打了封闭,中餐厅,薇娅谢霆锋直播,罗云熙若风进军LOL手游电竞,张艺兴 中国队yyds,李月汝罚球绝杀,家庭条件对孩子成才的影响有多大,马龙樊振东升国旗奏国歌,国乒三剑客永远的神,游客离开张家界须完成三次核酸检测,女儿1个多月未见抗洪爸爸被吓哭,周也中餐厅的第一顿晚餐,龚俊吃饭好香,兵马俑景区附近现多辆急救车,西安大雁塔北广场喷泉表演暂停,樊振东夺乒乓球男单银牌,抗洪救援队返程被收千元过路费,奥恰洛夫哭了,用最狠的态度说最卑微的话,严浩翔退出少年说唱企划,马龙采访,中国好声音,吴京看到易烊千玺造型的反应,阚清子倪虹洁催泪告别,李荣浩周杰伦合唱默,马龙3届奥运传奇回顾,刘国梁马琳轻松观战,

2021-07-31,阿根廷别墅整栋掉入海中,郑州新增1例无症状感染者,宁静 有一期中餐厅我觉得不好看,皮卡丘花木兰ID失踪了,杨舒予谈及感情状况笑称我还小,南京疫情,马龙养伤期间看科比纪录片鼓励自己,人类高质量让球,伊藤美诚教练称孙颖莎不按套路打球,刘国梁夸巴赫懂球,马龙成首位奥运男单双冠王,林生斌被曝家暴出轨,郑州疫情,贵州铜仁发现桃花水母,南京暂停开放旅游景区室外区域,湖南张家界新增3例本土确诊,网友留言鼓励樊振东,孙红雷劝小演员把学上完,美国混合接力队恢复决赛资格,银川新增1例确诊病例,扬州泰州国际机场暂停所有客运航班起降,刘国梁观众席解说,男子21层扔下25斤重椅子被判刑六个月,林生斌前岳父母首发声,女儿们的恋爱4嘉宾,黄子韬宋亚轩拥抱落泪,谢霆锋状态,周深说没有好声音不会成为歌手,余生请多指教,雨衣爸爸称后悔没教女儿学游泳,马龙夺乒乓球男单金牌,王靖雯上好声音了,全剧唯一认真反派李美娥,31日东京奥运会看点,马龙的保温杯vs樊振东的冰水,丁真 我是四川的,姚安娜有点憨,塔克拉玛干沙漠发洪水,奥运奖牌榜,国乒队队歌听上瘾了,中国女篮挺进奥运8强,联合签名,白宇奥运播报,张真源清唱水星记,国乒到底是多少人的心理阴影,北京现可爱粉和绚丽金浪漫晚霞,马龙说奥运夺冠像做梦,顶楼3,周也中餐厅的第一顿晚餐,宁静笑死我了,

2021-07-31,中国队获4X100米男女混合泳接力银牌,张继科说这届奥运会很不一样,桥本大辉回应夺金质疑,李莎旻子隔壁老樊官宣恋情,杨舒予见到爸妈的瞬间泪崩,周扬青 我不是为了免费的半熟芝士,七夕怎么妆,樊振东练球5年仅缺勤5天,南京疫情,原来樊振东也有腰窝,长沙新增阳性曾与北京确诊共同就餐,新中国第一个世界冠军,宁静 有一期中餐厅我觉得不好看,樊振东版的你行你上,江苏新增19例本土确诊,郑州阿姨与江西消防员的暖心约定,拜尔斯退出跳马和高低杠比赛,马龙回应夺冠后再度比心,巴赫点赞中国奥运代表团,汪顺小时候不听话老师打电话告状,扬州新增10例本土确诊,菟小白,林生斌被曝家暴出轨,阿根廷别墅整栋掉入海中,王简嘉禾获800米自由泳第五名,赛场下的马龙,郑州新增无症状曾在产科就诊,人类高质量让球,扬州棋牌室,联合签名,四川新增1例本土确诊,女排赛场的BGM是他选的,福建新增1例本土确诊,上海暴雨,莱德基好强,国乒到底是多少人的心理阴影,王一博和平精英新歌,丁程鑫说选我们18楼,男子21层扔下25斤重椅子被判刑六个月,湖南疫情,马龙成首位奥运男单双冠王,张雨霏好猛,石宇奇无缘男单四强,关晓彤为中国奥运健儿加油,南京市新增本土确诊病例6例,英国队第三棒,暴雨版红伞伞白杆杆,贵州铜仁发现桃花水母,马龙转圈比心有多可爱,女儿们的恋爱4嘉宾,

2021-07-31,卢云秀女子帆板夺金,周扬青承认与罗昊的恋情,张雨霏放弃50米自由泳加赛,和平精英空投节,张雨绮李柄熹官宣恋情,奥运会三面中国国旗名场面,高磊失误,德尔塔毒株或导致更严重疾病,郑州发现多例疑似病例,董栋获蹦床银牌,日本蹦床男队失误,难民代表团 心酸,父母陪李莎旻子隔壁老樊逛街,没有人比许昕更爱许昕,中国队获4X100米男女混合泳接力银牌,四川一次密接因拒绝隔离被行拘,林俊杰想拜马龙为师,黄晓明吃西瓜吃得好干净,厦门疫情,李莎旻子隔壁老樊官宣恋情,董栋晋级男子蹦床决赛,启蒙教练称孙颖莎打球就像吃蜜,周扬青 我不是为了免费的半熟芝士,宋小宝说我不喷防晒就完了,男单乒乓球颁奖典礼解说太会了,郑州第六人民医院停诊,即日起离开郑州需48小时内核酸阴性,官方辟谣男子吵架自称父亲是检察长,美国游泳选手泳镜游掉了,苏州所有棋牌室麻将室一律暂停开放,桥本大辉回应夺金质疑,张继科说这届奥运会很不一样,孙俪手写49遍理想之城,余生请多指教,没有人天生就是六边形战士,助手提醒拜登下巴上有东西,陈清晨说争金牌,你是我的荣耀,高磊曾经把蹦床弹簧跳断,超过8周接种第二剂疫苗也能产生抗体,联合签名,中国队第20金,张雨霏的笑太有感染力了,长沙3地调为中风险,张哲瀚看奥运高尔夫直播,徐嘉余爸爸看比赛紧张到握拳,在她身上看到了奥林匹克精神,北京疫情,谌龙VS周天成,南京通报新增6例本土病例详情,

2021-07-31,东京奥运出现首例兴奋剂事件,吕小军举重81公斤级夺金,吕小军刷新奥运纪录,皮卡丘花木兰ID失踪了,美游泳选手失金称比赛不干净,可以学习张继科不能学习张怡宁,打疫苗后又被感染系突破病例,中国女排提前无缘八强,施廷懋王涵前两名晋级3米板决赛,三年后再战,中国队第21金,孙颖莎和巴赫换徽章,日本跳水失误,宁静 我对房车没什么好印象,10岁男孩跳水神级压水花惊艳全场,和平精英单排王,南京疫情重症患者均感染德尔塔变异株,李晨戴燕妮祝贺女篮胜利,军神,关晓彤晒合照为奥运健儿加油,卢云秀女子帆板夺金,最想问中国游泳队的问题,李莎旻子送老樊一到二十二岁生日礼物,周扬青承认与罗昊的恋情,司机没拉手刹副驾随车冲下山坡,一旦发现疫情第一时间启动应急处置,张雨绮李柄熹官宣恋情,跳水女子3米板半决赛,男子举重81公斤级决赛,孟子义妈妈是女儿最大的黑粉,李佳伦说对不起祖国人民,郑州市卫健委主任被免职,key有多高lucky就有多强,南京此轮疫情短期内仍有扩散风险,锦衣之下央八定档,郑州发现多例疑似病例,美国对世卫组织虚伪支持包藏险恶居心,加拿大跳水失误,心疼朱婷,林俊杰想拜马龙为师,郑州一地调整为高风险地区,许凯发博斥私生,吕小军yyds,奖牌榜,我国不同技术路线的新冠疫苗不可混打,羽毛球女单半决赛,北京申冬奥成功六周年,你好火焰蓝豆瓣开分5.6,裁判找吕小军签名,毕焜男子帆板夺铜,

2021-07-31,苏炳添晋级百米半决赛,此次疫情会大规模暴发吗,尼日利亚 抢跑,徐新驰饰演石油工人,李佳伦说对不起祖国人民,打疫苗后又被感染系突破病例,谢震业是200米首位破20秒的黄种人,假如和马龙张继科许昕做同学,吕小军举重81公斤级夺金,李克勤是国羽头号粉丝吧,陈雨菲晋级女单决赛,苏炳添最后转头绝了,日本国奥晋级四强,吕小军夺冠后抱起主教练,黄子韬给郑元畅李菲儿当过群演,吕小军刷新奥运纪录,嫁给经历6次截肢手术的军人男友,王一博 一般我用四倍镜,苏炳添的凡尔赛冲刺,网友凡尔赛评论太秀了,林之校顾魏太甜了,裁判找吕小军签名,南京市民向抗疫一线捐100箱鸭血粉丝汤,李汶翰于小彤阿Sa换头像,日本多地免费送房,阚清子发文告别榴莲,田径,王一博 绿海,5岁女孩边哭边打乒乓球曾得第一,蹦床部分成绩由电子裁判打分,跳远,中国队第21金,王春雨晋级女子800米决赛,中国举重队已获5枚金牌,阿朵 节制可以提升爱的质感,荷兰球星弗林蓬为马龙欢呼被德国队友追打,王一博拿信号枪好帅,快乐大本营,疫情中高风险地区汇总,3人为牟利协助多人非法离宁被刑拘,铁饼,黄常洲晋级男子跳远决赛,董栋称生涯圆满,江苏学校开学前15天不得再作为核酸检测点,TES UP,吕小军背肌夹A4纸,UP战胜TES,奥运会破防瞬间,可以学习张继科不能学习张怡宁,网友偶遇吴永恩探班王子文,

