2021-08-16,菅义伟宣称日本不会再发动战争,iPhone13系列价格或与12保持一致,马赛,这才是人间清醒的粉丝,中纪委发文评张哲瀚事件,阿富汗总统加尼同意辞职,蔡徐坤维达品牌代言人,她让全世界知道了南京大屠杀,目前未接到任何有关在阿中国公民伤亡报告,张彬彬从头到尾没信过郭京飞,塔利班释放阿富汗最大监狱约5000名囚犯,和好朋友不再联系的原因,江苏常州发生交通事故致2死6伤,越南一家8口感染新冠同日离世,张哲瀚粉丝后援会清空微博,马龙说2019年接受手术是冒险但值得,驻阿富汗大使馆提醒中国公民加强安全防护,王一博仿佛开了个假螃蟹,家长要不要干预孩子的朋友圈,贾静雯晒全家福为咘咘庆生,尹正悼念马赛,张馨予妈妈把打假看成打架,阿富汗首都街头一片混乱,老人穿马路致3车追尾还回头看热闹,阿富汗总统将辞职,辛云来用冰水煮泡面,阿里女员工被侵害案采取测谎辅助手段,实拍阿富汗首都混乱景象,你是我的荣耀吻戏花絮,芦玉菲隔离训练,陈露索要900万分手费算敲诈吗,许昕七夕给老婆送了花,杨洋说撒老师辛苦了,甘望星再唱水星记,沃尔玛中国又关店了,猫究竟可以胖到什么程度,85岁奶奶深夜卖煎饼15年,阿里女员工,邓紫棋工作室生日周边价格,凤小岳妻子怀孕9个月引产,被猫咪的背影萌到了,尼格买提手术室外流泪等候,开了美颜后的许昕,央视曝光便携风扇使用风险,李庚希一眼入戏,天天向上,蔚来车主自动驾驶车祸行驶数据公布,西安三中门口开了30年的烧烤摊,张艺兴中式盘扣流光外套,老baby的七夕太上头了,

2021-08-16,菅义伟宣称日本不会再发动战争,iPhone13系列价格或与12保持一致,塔利班释放阿富汗最大监狱约5000名囚犯,缤智 精享生活百货,阿富汗首都街头一片混乱,马赛,目前未接到任何有关在阿中国公民伤亡报告,这才是人间清醒的粉丝,中纪委发文评张哲瀚事件,阿富汗总统加尼同意辞职,张彬彬从头到尾没信过郭京飞,越南一家8口感染新冠同日离世,江苏常州发生交通事故致2死6伤,张哲瀚粉丝后援会清空微博,她让全世界知道了南京大屠杀,和好朋友不再联系的原因,王一博仿佛开了个假螃蟹,贾静雯晒全家福为咘咘庆生,甘望星再唱水星记,驻阿富汗大使馆提醒中国公民加强安全防护,家长要不要干预孩子的朋友圈,马龙说2019年接受手术是冒险但值得,尹正悼念马赛,张馨予妈妈把打假看成打架,陈露索要900万分手费算敲诈吗,老人穿马路致3车追尾还回头看热闹,阿里女员工被侵害案采取测谎辅助手段,林更新做的酱牛肉,辛云来用冰水煮泡面,实拍阿富汗首都混乱景象,你是我的荣耀吻戏花絮,凤小岳妻子怀孕9个月引产,天天向上,猫究竟可以胖到什么程度,西安三中门口开了30年的烧烤摊,杨洋说撒老师辛苦了,阿富汗总统将辞职,85岁奶奶深夜卖煎饼15年,蔚来车主自动驾驶车祸行驶数据公布,央视曝光便携风扇使用风险,阿里女员工,张艺兴中式盘扣流光外套,被猫咪的背影萌到了,沃尔玛中国又关店了,邓紫棋工作室生日周边价格,芦玉菲隔离训练,扫黑风暴,尼格买提手术室外流泪等候,许昕七夕给老婆送了花,开了美颜后的许昕,

2021-08-16,阿富汗总统已逃离喀布尔,塔利班宣布攻占总统府,全红婵水花消失术是怎样炼成的,女子将10年校园欺凌经历做成桌游,阿里女员工被侵害案六大待解疑问,权志龙探班jennie,蔡徐坤维达品牌代言人,美在韩研究病毒毒性比炭疽菌强10万倍,这才是人间清醒的粉丝,没开美颜的许昕和开了美颜的谌龙,扬州大学附属医院3名医生确诊,一部电视剧长达807集,马龙说尽量在能打球的时候多打一点,国家广电智库评张哲瀚事件,菅义伟宣称日本不会再发动战争,当你突然没化妆,许昕问谌龙七夕节送老婆礼物了吗,iPhone13系列价格或与12保持一致,苏炳添理性分析自己比赛中的短板,乔峰接任丐帮帮主,塔利班夺权时间线,时代少年团成员为严浩翔庆生,和好朋友不再联系的原因,300元一根的上头电子烟成本仅几十,张彬彬被念叨崩溃了,塔利班发言人称在阿富汗战争已结束,王一博仿佛开了个假螃蟹,阿富汗首都物价飙升,贾静雯晒全家福为咘咘庆生,梅西球衣24小时卖100万件,天龙八部,阿政府代表团将赴卡塔尔与塔利班会谈,家长要不要干预孩子的朋友圈,施廷懋说喜欢收集金牌,航拍镜头下的死海之盐,海地地震死亡人数升至1297人,中纪委发文评张哲瀚事件,多国驻阿富汗人员加紧撤离,张彬彬从头到尾没信过郭京飞,官方通报男子公园驾车撞人致2死6伤,孙兴慜破门,你是我的荣耀,林更新做的酱牛肉,张馨予妈妈把打假看成打架,河南虞城8人防疫不力被处理,辛云来用冰水煮泡面,CCTV6今天播放一条狗的回家路,为什么大领导大多都很和善,甘望星再唱水星记,杨洋说撒老师辛苦了,

2021-08-16,CCTV6今天播放一条狗的回家路,特朗普就阿富汗局势炮轰拜登,泫雅金晓钟将合体出道,不被看见的付出要继续吗,权志龙探班jennie,阿里女员工被侵害案六大待解疑问,外婆借做核酸检测带外孙见爸爸,程序员手疼7年查出骨肿瘤,任泽平称生三胎每月奖励三千至五千元,济南大润发发臭隔夜肉洗了再卖,全运会,泫雅一天要晕倒好几次,阿富汗总统已逃离喀布尔,塔利班希望阿富汗逃亡民众留下来,一部电视剧长达807集,江苏疫情,你是我的荣耀,巩立姣说自己敷面膜又白回来啦,拳力以赴的我们阵容官宣,上海地铁,当你突然没化妆,女子想支持国货嫌贵偷新鞋被抓,全爸希望全红婵未来能够上大学,塔利班宣布攻占总统府,陈奕迅不期而遇的夏天,安徽欺凌事件10名违法行为人被处罚,玉楼春女子群像大片,英孚教育称愿接纳华尔街英语学员,人民日报谈网络欺凌现象,原来这才是真正的蛙泳,乔峰接任丐帮帮主,17岁时的蔡徐坤,原来下午茶文化起源中国,全红婵水花消失术是怎样炼成的,为什么大领导大多都很和善,小米汽车总部将落户北京,感染炭疽病毒什么症状,北京大中小学幼儿园如期开学,阴阳师绘世花鸟卷,两弹一星元勋于敏诞辰,5.6万只盐水鸭到达禄口封控区,粉丝写给严浩翔的生日信,塔利班发言人称在阿富汗战争已结束,许昕的擦汗动作,300元一根的上头电子烟成本仅几十,玉楼春,河南新增6例本土确诊,实拍阿富汗首都混乱一天,女子将10年校园欺凌经历做成桌游,江苏新增6例本土确诊病例,

2021-08-16,芒果TV艺人艺德承诺书,美国花超2万亿美元留下个烂摊子,美方威胁关闭阿富汗最后逃生通道,成都一共享单车坐垫被插针,陈梦的腹肌是这样练成的,迪丽热巴说自己比乔晶晶成熟,苏炳添回应网友催生二胎,赴美留学机场千米排长队十万票价再现,丁真洗碗姿势也太好笑了,阿里女员工被侵害案采取测谎辅助手段,宋智孝40岁状态,千万别用酒精清洁电脑屏幕,美国被曝偷工减料训练阿富汗部队,孙红雷51岁状态,外婆借做核酸检测带外孙见爸爸,夏之光身高精确到小数点后7位,拜登曾称塔利班不可能重新掌权,一部电视剧长达807集,蔚来工作人员私自接触事故车辆被传唤,许昕 这优秀的左撇子,泫雅一天要晕倒好几次,倪萍 反尔赛,被一根棉签可爱到了,权志龙探班jennie,薅羊毛的社死现场,17岁时的蔡徐坤,塔利班希望阿富汗逃亡民众留下来,中世纪的猫猫原来长这样,CCTV6今天播放一条狗的回家路,在美阿富汗人白宫前抗议,塔利班撤下阿富汗总统府国旗,杨幂许凯拥抱路透,金晨国风刺绣丝绒裙造型,孙世杰说要休了吴月红,主播自带燃气做饭蹲守全红婵家,桃夭又回来了,女子开纯空壳车路上狂飙,阿富汗副总统称他仍留在国内,天津高考报名条件调整为户籍加学籍,大润发回应售卖发臭隔夜肉,龚俊新歌把未来点亮,周雨彤演戏代入感,阿富汗难民飞抵印度后控诉,程序员手疼7年查出骨肿瘤,任泽平称生三胎每月奖励三千至五千元,身在喀布尔的中国人,你是我的荣耀,世界微尘里,美国总统的阿富汗政策翻车现场,新版天龙八部台词,

2021-08-16,李承铉当全职爸爸抑郁了一年多,身在喀布尔的中国人,伊藤美诚说世乒赛要击败很多中国选手,6岁娃赌气要吃100个冰棍妈妈帮实现,华春莹说期待阿富汗人民远离战乱,女子抱孩子开车直播称不怕被交警逮到,七夕约会斩男系列,披荆斩棘的哥哥 二公淘汰,芒果TV艺人艺德承诺书,千万别用酒精清洁电脑屏幕,原来学霸学习也很暴躁,山河令删除张哲瀚名字,同龄人的真实收入是怎样的,陈漫镜头下的黄轩和邓伦,杨倩快本再现比心名场面,甘肃省原常务副省长宋亮被双开,许魏洲乔欣太嗑了,孙世杰说要休了吴月红,1975年美军紧急逃离西贡,男子将野生中华鲟分解放冰箱,新能源大跌,张馨予自己种的瓜熟了,鞠婧祎晒wink自拍plog,孙红雷51岁状态,宋智孝40岁状态,大部分在阿富汗中国公民已先期回国,美国花超2万亿美元留下个烂摊子,桃夭又回来了,INTO1水手服,男子进小区遇封闭天台上睡14天,美军在喀布尔机场向阿富汗人开火,阿富汗总统加尼逃亡后首次发声,Red Velvet回归,泫雅一天要晕倒好几次,赴美留学机场千米排长队十万票价再现,陈梦的腹肌是这样练成的,隧道里的王嘉尔,美方威胁关闭阿富汗最后逃生通道,暗格里的秘密提档,天龙八部,拜登曾称塔利班不可能重新掌权,成都一共享单车坐垫被插针,长征七号遥四运载火箭运抵发射场,张哲瀚将ins设为私密账户,中世纪的猫猫原来长这样,薅羊毛的社死现场,吉林一男子乘出租车偶遇300多斤老虎,被一根棉签可爱到了,外交部回应中方是否承认阿富汗塔利班,千禧漫画雀斑妆,

