2021-06-27,考出668分好成绩女孩怀疑加错了,钟南山说过去的密接概念已不适用,潘玮柏带老婆现身孟佳演唱会,毛不易 我听见一些不太吉利的声音,蜜雪冰城开在东京是什么样的,变成你的那一天,张翰宋丹丹回应尴尬名场面,威尔士 丹麦,草莓月亮,七子之歌,马嘉祺 什么是快乐星球,Hero夺冠,周也对孟子义撒娇说抱我,王毅说中国这一票永远属于发展中国家,德尔塔变异毒株致多国疫情反弹,快乐大本营下期有梁靖康,童谣梦到陆思诚,吃个面搞得跟越狱似的,欧洲杯,百年礼赞,杨幂不定期随手记上线,张雨绮谈改名原因,张云龙回应怎么跟精修图长得不一样,孟子义性格,广州隔离病房高考生成绩出炉,鹿晗紫发造型,崔普闵是整容了吗,南京确立鸭血粉丝汤速食装生产标准,全男四胞胎高考最高626分,你和妈妈吵架会先服软吗,周冬雨王一博年轻的朋友来相会,江熠余声声吻戏好欲,大象一天80%时间在吃东西,如何评价RNG输给FPX,钟南山谈德尔塔变异毒株密接新概念,叛逆者结局,快乐大本营,朱一龙童瑶互称同志,狗狗吃个药学会了说唱,广州海关依法退运72.4吨洋垃圾,五十公里桃花坞,陆思诚男友力,清清的露娜,100秒仰望云南绝美星空,银行柜员劝阻女子免遭587万电信诈骗,千古玦尘预告,清融FMVP,成都天府国际机场另类大片,如何正确的止血,清华老教师与年轻人合唱,

2021-06-27,意大利 奥地利,钟南山说过去的密接概念已不适用,考出668分好成绩女孩怀疑加错了,潘玮柏带老婆现身孟佳演唱会,毛不易 我听见一些不太吉利的声音,变成你的那一天,张翰宋丹丹回应尴尬名场面,蜜雪冰城开在东京是什么样的,德尔塔变异毒株致多国疫情反弹,丹麦4比0威尔士,欧洲杯,马嘉祺 什么是快乐星球,Hero夺冠,王毅说中国这一票永远属于发展中国家,七子之歌,心疼贝尔,宋祖儿王子异小名都叫小狗,快乐大本营下期有梁靖康,全男四胞胎高考最高626分,意大利奥地利加时赛,江熠余声声官宣,张雨绮谈改名原因,张云龙回应怎么跟精修图长得不一样,威尔士 丹麦,广州海关依法退运72.4吨洋垃圾,孟子义性格,杨幂不定期随手记上线,你和妈妈吵架会先服软吗,吃个面搞得跟越狱似的,童谣梦到陆思诚,周也对孟子义撒娇说抱我,崔普闵是整容了吗,鹿晗紫发造型,草莓月亮,钟南山谈德尔塔变异毒株密接新概念,大象一天80%时间在吃东西,阿瑙托维奇进球无效,百年礼赞,南京确立鸭血粉丝汤速食装生产标准,成都天府国际机场另类大片,五十公里桃花坞,林楠笙朱怡贞是he吗,银行柜员劝阻女子免遭587万电信诈骗,基耶萨破门,广州隔离病房高考生成绩出炉,佩西纳破门,如何评价RNG输给FPX,叛逆者结局,清华老教师与年轻人合唱,清清的露娜,

2021-06-27,张凯丽母女争执,网红清凉神器有多危险,男子投资失败在网吧3个月被撵走,考出668分好成绩女孩怀疑加错了,你的婚礼,变成你的那一天,脆汁鸡必C玄学,意大利 奥地利,清华大学2021年本科生毕业典礼,潘玮柏带老婆现身孟佳演唱会,七一勋章颁授仪式将隆重举行,毕业生花100小时为辅导员画表情包,斯里兰卡海岸现数百海龟海豚尸体,建党100周年庆祝大会第二次综合演练,蜜雪冰城开在东京是什么样的,周也对孟子义撒娇说抱我,tony老师您昨晚睡得好吗,宋江韩素希好会吻,陈情令国风艺术展,王冰冰分享旧照,在学校被孤立了怎么办,张睿看宋轶腿粗问她是不是穿秋裤了,左肩有你还原度好高,欧洲杯历史第一对父子进球,毛不易 我听见一些不太吉利的声音,成都天府国际机场通航直播,钟南山说过去的密接概念已不适用,快乐大本营下期有梁靖康,窦骁掉泥潭心态崩了,江熠余声声官宣,1921,张新成演技,小时候被爸妈痛揍的原因,宋祖儿王子异小名都叫小狗,张雨绮谈改名原因,王毅说中国这一票永远属于发展中国家,意大利打破不败纪录,心疼贝尔,虽然我知道,日本鳗鱼价格上涨超三成,太阳 快船,三胞胎兄弟高考平均超650分,国漫MV振山河,马嘉祺 什么是快乐星球,女子带母亲到工厂上班,英国卫生大臣辞职,百年党史里的妙喻,德尔塔变异毒株致多国疫情反弹,吃个面搞得跟越狱似的,欧洲杯,

2021-06-27,周柯宇为了不曝光新发色有多努力,乌克兰宣布撤回反华声明联署,肖战成都美食记,张凯丽母女争执,理发店纹眉一根88元被停业整顿,tony老师您昨晚睡得好吗,网红清凉神器有多危险,七一勋章颁授仪式将隆重举行,男子投资失败在网吧3个月被撵走,清华大学2021年本科生毕业典礼,考出668分好成绩女孩怀疑加错了,三胞胎兄弟高考平均超650分,美国一热气球坠毁已致至少4死,女孩做迷你婚纱最小57厘米,斯里兰卡海岸现数百海龟海豚尸体,王嘉尔发文庆祝TEAMWANG四周年,女子带母亲到工厂上班,闫永强道歉,图书馆占座有多霸道,宋江韩素希好会吻,张睿看宋轶腿粗问她是不是穿秋裤了,陈情令国风艺术展,孟佳谈年龄焦虑,毕业典礼父母穿儿子学士服圆梦,建党100周年庆祝大会第二次综合演练,张新成演技,Mine,王冰冰分享旧照,英国破获1.14亿英镑加密货币洗钱案,发改委 预计7月份煤价将进入下降通道,窦骁掉泥潭心态崩了,虞书欣暗影宫廷风plog,左肩有你还原度好高,军人遇堵车1分钟疏通,钟南山说过去的密接概念已不适用,杨清柠毛宸宸分手,毕业季南京地铁的仪式感,毛不易 我听见一些不太吉利的声音,如果外星人真来地球了,成都天府国际机场通航直播,妈妈水下古风大片,人类特倒霉时刻,你的婚礼,佩里西奇新冠阳性,1921,德尚被困在酒店顶楼阳台,七一勋章是如何铸成的,印度象群误入村庄遭鞭炮驱赶,七子之歌,德尔塔变异毒株致多国疫情反弹,

2021-06-27,女孩考692分想当程序员,外孙女出嫁外公不舍大哭送出门,今年新增37个本科专业,Lisa好辣,乌合麒麟收回道歉,张翰孟子义cp感,六月最后3天红包狂撒,在摩尔庄园开了一家驾校,被宿管阿姨阻挡的爱情,我国五大最高荣誉即将颁齐,贝尔被记者惹怒,肖战成都美食记,乌克兰宣布撤回反华声明联署,骗子冒充领导让财务转账238万,专家提醒慎用除甲醛小魔盒,男子救老人前录像喊话别讹我,金圣圭确诊感染新冠,农夫山泉 福岛水果,女孩做迷你婚纱最小57厘米,刘芸妈妈水下照眼神,七一勋章颁授仪式将隆重举行,杨清柠毛宸宸分手,海关在饼干里查出5张LSD致幻剂,tony老师您昨晚睡得好吗,武汉暴雨,日本为何迟迟未研发出新冠疫苗,周柯宇为了不曝光新发色有多努力,鞠婧祎郭俊辰花戎开机路透,广东中考数学,论文选题能有多有趣,快船太阳球迷打架,张凯丽母女争执,刘宇宁不说再见片尾曲,没想到社死还可以传递,年轻演员合唱少年,理发店纹眉一根88元被停业整顿,军人遇堵车1分钟疏通,张睿看宋轶腿粗问她是不是穿秋裤了,问猫的动态把爸爸问烦了,美国见义勇为者反被警察开枪打死,许凯花絮好皮,虞书欣暗影宫廷风plog,向佐喝的啤酒比头还大,成都进入双机场时代,90后工程师6年参加15次航天发射,六百万与六百分,失散23年母子终团聚,农夫山泉否认涉日本福岛进口成分,宋江韩素希好会吻,网红清凉神器有多危险,

2021-06-27,外卖小哥高考623查分后淡定送外卖,今年新增37个本科专业,杨利伟的太空一日,女孩毕业一家9口到场庆祝,买到不甜的西瓜怎么办,国民床单的设计师画它时身处热恋中,合肥一中脑瘫少年高考603分,解码中国共产党为什么能,俄罗斯一住宅楼被闪电劈中,台湾首现德尔塔变异毒株,男生用空调外机烘干袜子,女子2次忽略反诈提醒落入刷单骗局,农夫山泉否认涉日本福岛进口成分,广州天气,伦敦爆发大规模反封锁抗议,张杰分享打疫苗过程vlog,假性亲密在友情中的表现,问猫的动态把爸爸问烦了,梁洁男友视角好甜,刘嘉玲镜头下的梁朝伟,Angelababy生图状态,Lisa好辣,任正非称华为要防止内卷,乌合麒麟收回道歉,郑渊洁的短板,孟子义和经纪人互怼,苏有朋作为偶像到底有多强,花戎官宣,六百万与六百分,杨清柠毛宸宸分手,向佐喝的啤酒比头还大,在摩尔庄园开了一家驾校,女孩考692分想当程序员,外孙女出嫁外公不舍大哭送出门,中国男篮历经28小时抵达赛区,陈伟霆腹肌,武汉暴雨后一男孩积水中游泳,家人是如何看待你化妆的,奔跑的小朋友像裹了彩虹,深圳机场看不见的216个小时,奇异博士看了也无语,新型毒品伪装成可乐奶茶,超治愈的合影,抹茶白玉抱抱碗,LGD SN,华农食堂大姐毕业致辞要好好吃饭,2021LPL,张哲瀚拍摄幕后花絮vlog,2名游客被困海拔4750米无人区,发布会介绍新时代党史和文献工作,

