2021-06-30,死亡之组全部死亡,新闻联播,贝克汉姆黄老板同框,不好的全抛光,穆勒单刀不进,英格兰2比0德国,韩国出土1000多个汉字金属活字,勒夫最后一场国家队比赛,今日顶流张桂梅校长,祖父李大钊的心愿实现了,凯恩破门,欧洲杯,爷爷收到在党50年纪念章的反应,黄鹤楼上亮起巨型党徽,高考623分外卖小哥决定留在武汉上学,成全张桂梅的人,格纳布里 伦敦之王,新闻联播 破晓,见过最委屈的狗狗,斯特林破门,1921,高校男生记录恋爱中每次分别,可乐把C罗挪走了,Rookie状态,德国小球迷哭了,走失小男孩在派出所被疯狂投喂,易烊千玺中国医生花絮,德波尔下课,老人被卷公交车底众人抬车施救,英格兰晋级八强,新华社记者瞿独伊获得七一勋章,新闻联播里的刘诗诗,杨紫李现民国造型,日本最大核电站因安全缺陷无法重启,大乔白鹤梁神女,杨洋民国长衫造型,王俊凯1921原声花絮,见过最温柔的沟通方式,瑞典 乌克兰,中国共产党要始终成为时代先锋,张颂文还原李大钊就义,欧洲杯赛程,川崎前锋7比0国安,当咖啡里出现气泡,孟美岐千里同好唱河南,德国队出局,诺伊尔跑到了中场,德国 英格兰,张桂梅的这双手触动人心,江苏102个婚姻登记处提供免费婚前辅导,

2021-06-30,死亡之组全部死亡,新闻联播,再见德国队 再见我的青春,韩国出土1000多个汉字金属活字,瑞典 乌克兰,今日顶流张桂梅校长,贝克汉姆黄老板同框,祖父李大钊的心愿实现了,英格兰2比0德国,德国小球迷哭了,欧洲杯,爷爷收到在党50年纪念章的反应,穆勒单刀不进,川崎前锋7比0国安,老人被卷公交车底众人抬车施救,新闻联播 破晓,凯恩破门,见过最委屈的狗狗,诺伊尔跑到了中场,高考623分外卖小哥决定留在武汉上学,高校男生记录恋爱中每次分别,可乐把C罗挪走了,成全张桂梅的人,大乔白鹤梁神女,勒夫最后一场国家队比赛,英格兰晋级八强,Rookie状态,中国共产党要始终成为时代先锋,想念克洛泽,走失小男孩在派出所被疯狂投喂,新闻联播里的刘诗诗,杨紫李现民国造型,杨洋民国长衫造型,日本最大核电站因安全缺陷无法重启,江苏102个婚姻登记处提供免费婚前辅导,新华社记者瞿独伊获得七一勋章,德波尔下课,王俊凯1921原声花絮,教育部开通高校学生资助热线电话,张桂梅的这双手触动人心,张桂梅说她是代全国党员在台上汇报,民警帮老兵找回遗失抗美援朝胜利纪念章,黄鹤楼上亮起巨型党徽,见过最温柔的沟通方式,德国队出局,当咖啡里出现气泡,孟美岐千里同好唱河南,易烊千玺中国医生花絮,1921,张颂文还原李大钊就义,

2021-06-30,中国正式获得世卫消除疟疾认证,中国共产党成立100周年纪念邮票,2021上半年最后1天,新闻联播,新疆消防员的颜值有多高,世卫称赞中国获得消除疟疾认证,韩国出土1000多个汉字金属活字,浙江2亩荷塘开出89朵并蒂莲,王珞丹手写腾飞致敬航空梦,美国房价创30多年最大涨幅,失窃近十年的毕加索画作被希腊警方查获,男子拍照把自己拍成景点,祖父李大钊的心愿实现了,核电站安全漏洞不断东电社长鞠躬道歉,工作中碰到的神仙领导,小区里的小羊肖恩,英格兰2比0德国,成全张桂梅的人,新闻联播 破晓,爷爷收到在党50年纪念章的反应,死亡之组全部死亡,威廉王子观战英德大战,高校男生记录恋爱中每次分别,见过最委屈的狗狗,乌克兰绝杀瑞典,再见德国队 再见我的青春,欧洲杯,贝克汉姆黄老板同框,叛逆者,黄鹤楼上亮起巨型党徽,新闻联播里的刘诗诗,杨紫李现民国造型,杨洋民国长衫造型,9图回望中国共产党百年足迹,川崎前锋7比0国安,走失小男孩在派出所被疯狂投喂,高考623分外卖小哥决定留在武汉上学,Rookie状态,大乔白鹤梁神女,特雷杨缺席东决G4,当咖啡里出现气泡,NBA季后赛,全景打卡红色地标,可乐把C罗挪走了,见过最温柔的沟通方式,红色百年路,日本最大核电站因安全缺陷无法重启,易烊千玺中国医生花絮,老人被卷公交车底众人抬车施救,德国小球迷哭了,

2021-06-30,7月新规,iPhone13没有屏下指纹解锁,重庆一小学楼顶种14000株向日葵,新疆消防员的颜值有多高,2021上半年最后1天,中国正式获得世卫消除疟疾认证,华理把学校气味做成香氛送毕业生,90后大学英语老师自编上千页教材,加拿大高温致130多人死亡,把鼻子捏成了火箭,字母哥受伤,男子拍照把自己拍成景点,中国共产党成立100周年纪念邮票,中国共产党党员总数为9514.8万名,九千万人拥有同一个名字,奈雪的茶上市首日破发,去看牙引发的社死现场,马苏演的母亲好温柔,大叔将上万废酒瓶做成艺术花盆,失窃近十年的毕加索画作被希腊警方查获,施罗德想要1亿美元大合同,当广东人唱周杰伦的歌,死亡之组全部死亡,红船,电动车停放新规8月起施行,同济大学时光笔记可保存200年,芬兰近300人赴俄观球后感染,中国共产党现有基层组织486.4万个,小区里的小羊肖恩,欧洲杯八强,内蒙古女法官背国徽策马办案,东京奥运菜单有福岛比目鱼,全国两优一先名单公布,9图回望中国共产党百年足迹,澳大利亚副总理不戴口罩遭民众举报,新闻联播,杨紫李现民国造型,工作中碰到的神仙领导,一根线画出百年大党的理想,有哪些说话给人下套的例子,新闻联播里的刘诗诗,叛逆者,被这个绕口令破防了,卡佩拉篮板后投篮,祁发宝获全国优秀共产党员称号,欧洲杯,韩国出土1000多个汉字金属活字,萌娃动物园抢猩猩果冻,四个字形容2021上半年,美国房价创30多年最大涨幅,

2021-06-30,7月新规,鸟巢烟花五星图案是为了这一时刻,中国共产党党员总数为9514.8万名,退税,广东的早茶指的是几点,深圳大鹏近海有鲸鱼出没,九千万人拥有同一个名字,中国3名航天员在空间站祝党生日快乐,中国共产党现有基层组织486.4万个,2021上半年最后1天,iPhone13没有屏下指纹解锁,奈雪的茶上市首日破发,王源1921剧照,同济通知书里有汪品先的笔记,霍尊李琦郑云龙演唱献礼曲星火,拌一拌就能做的酸奶蛋糕,最尴尬的撞衫经历,加拿大高温致130多人死亡,1921,我的真实英语水平,北京地铁今日起可刷数字人民币,被父母支持爱好有多幸福,中国正式获得世卫消除疟疾认证,不愧是泉城济南,字母哥受伤会影响雄鹿杀进总决赛吗,重庆一小学楼顶种14000株向日葵,能测空气中新冠病毒的口罩或面世,当福建人开口唱晴天,消防员求婚遇出警扭头就跑,7月起机动车发票实行一车一票,川渝两地将取消座机通话长途费,狗狗委屈起来是什么样的,当广东人唱周杰伦的歌,把鼻子捏成了火箭,一根线画出百年大党的理想,有哪些说话给人下套的例子,马苏演的母亲好温柔,消防员回应如何扑灭爱情的火,原来灰鲸的眼睛长这样,红船,中国共产党成立100周年纪念邮票,东京奥运菜单有福岛比目鱼,字母哥受伤,90后大学英语老师自编上千页教材,焦糖饼厚切冰三明治,守门员神仙级扑救瞬间,9图回望中国共产党百年足迹,男子拍照把自己拍成景点,广深第二高铁新通道列入国家规划,华理把学校气味做成香氛送毕业生,

2021-06-30,英雄机长刘传健获全国优秀共产党员,四分之一中共党员不超35岁,AI修复让李大钊陈延年们露出微笑,退税,两度割皮救父的少年最想报军校,新冠疫苗接种率达77.6%意味什么,被细高跟鞋支配的恐惧,张彬彬 生在中国太幸福了,65岁大妈科目一到科目四全部一把过,深圳大鹏近海有鲸鱼出没,海鸥被吸入挪威客机瞬间蒸发,1921票房破亿,iPhone13没有屏下指纹解锁,妈妈改造后的女儿,狗狗独自乘公交还自己下了车,当我只是摸了一下头发时,香港市民争相打卡国旗区旗旗海,广东的早茶指的是几点,鲜花断层蛋糕,土木工程女生少的原因,张嘉倪扫楼,男子两次接受肝移植去世后也捐献,这语文真是白学了,消防员求婚遇出警扭头就跑,什么是恋爱中的情绪价值,中国共产党党员总数为9514.8万名,监考时老师们都在干什么,新乡冰雹,王源1921剧照,西藏最大航站楼竣工,日本近2成硕士负债逾300万日元,买房契税9月1日上涨是谣言,奈雪的茶上市首日破发,博士毕业礼上说不后悔头秃,张哲瀚献唱电影红船主题曲,1921,鸟巢烟花五星图案是为了这一时刻,原来灰鲸的眼睛长这样,7月新规,中国3名航天员在空间站祝党生日快乐,那英演唱革命者主题曲,全国两优一先表彰名单公布,婚礼意外社死现场,马毛姐的勋章将送到渡江战役纪念馆,带口音的小学英语课本,油画里的动感百年,湖北发现两座清朝古山寨,九千万人拥有同一个名字,济南大风,中国共产党现有基层组织486.4万个,

2021-06-30,AI修复让李大钊陈延年们露出微笑,救心梗男子的女清洁工曾是工程老板,扬州大一学生被聘为实训助教,妈妈改造后的女儿,退税,蓝天野原名叫王润森,趋势潮研所,新冠疫苗接种率达77.6%意味什么,四分之一中共党员不超35岁,洛神水赋舞导演等了专业舞者三年,基金交易经手费收费下调,张彬彬 生在中国太幸福了,广东的早茶指的是几点,广东三起疫情社区传播均已阻断,iPhone13没有屏下指纹解锁,古巴退役飞行员哼唱中国歌曲,减肥成功给你带来了哪些改变,长沙人看烟花能有多积极,学校禁止的发型,张若昀发文致敬革命先烈,为什么广西人很好辨认,英国网红整容18次后宣布变成韩国人,张嘉倪给许凯人形立牌做造型,因为1921所以2021,奈雪的茶创始人否认是富二代,当我只是摸了一下头发时,被细高跟鞋支配的恐惧,小孩瀑布边玩水被激流卷走,雅诗兰黛再被罚高价护肤品值得买吗,婚礼意外社死现场,英雄机长刘传健获全国优秀共产党员,RNG TES,海鸥被吸入挪威客机瞬间蒸发,董明珠回应接班人问题,考生雨天打不到车当街拦车求助,鲜花断层蛋糕,如何成为一名共产党员,65岁大妈科目一到科目四全部一把过,狗狗独自乘公交还自己下了车,1921票房破亿,逐步提高领取基本养老金最低缴费年限,可盐可甜的老盐黄皮果,上海灯光秀,什么是恋爱中的情绪价值,长沙烟花,安徽脑瘫少年高考603分,韩民众为抢先打疫苗纷纷报名高考,西藏最大航站楼竣工,日本近2成硕士负债逾300万日元,洛神导演说河南卫视值得爆红,

2021-06-30,长沙烟花,入党全流程,710多万名党员获光荣在党50年纪念章,航天员在太空祝党生日快乐,中国共产党自述我的理想,谭松韵演的王会悟,领红包入场最后24小时,永不消逝电波的收报人公布,AI修复让李大钊陈延年们露出微笑,上海灯光秀,老党员寄语年轻人,张彬彬 生在中国太幸福了,一场虚拟的特殊面试,英雄城市用中国红致敬建党百年,这幅手书彰显中国共产党的奋斗精神,我心中最闪耀的红星,长沙人看烟花能有多积极,杨紫革命者接力朗读,鲜花断层蛋糕,新冠疫苗接种率达77.6%意味什么,退税,黄轩说王俊凯在片场话不多,原来猫咪生闷气是这样的,觉醒年代,减肥成功给你带来了哪些改变,20多位公交司机买下瓜农2000斤西瓜,深圳光影秀把党徽打在星空上,因为1921所以2021,当我只是摸了一下头发时,还记得你入党时的样子吗,安徽脑瘫少年高考603分,为什么广西人很好辨认,妈妈改造后的女儿,学校禁止的发型,扬州大一学生被聘为实训助教,救心梗男子的女清洁工曾是工程老板,洛神水赋舞导演等了专业舞者三年,广东三起疫情社区传播均已阻断,65岁大妈科目一到科目四全部一把过,张嘉倪给许凯人形立牌做造型,海鸥被吸入挪威客机瞬间蒸发,逐步提高领取基本养老金最低缴费年限,他们为什么建党,今年铁路暑运预计发送旅客7.5亿人次,已协助超170万海外中国公民接种疫苗,维和官兵组字100为党庆生,铁路暑运7月1日启动,百年青史就是他们的一生,基金交易经手费收费下调,iPhone13没有屏下指纹解锁,

